DNI,Asegurado,FecNac,SEXO,CPP,síntomas,enfermedad detectada,Distrito
30564690,Carlos Andrés Gutiérrez Paredes,1992-11-07,F,OTRO. SECTOR EL CAMPO NRO. PUERTA SN PISO.01,"dificultad para respirar, sibilancias",Asma,Socota
84776884,Carlos Pablo Herrera Sánchez,1998-01-07,M,CASERIO CHONTAS,"picazón, ojos llorosos, estornudos",Alergia,Socota
17076302,Lucía Luisa Delgado González,1959-05-01,M,SAN ISIDRO,dolor de cabeza,Gastritis,Socota
43973048,Jorge Isabel Ramírez Mendoza,1947-10-14,M,SAN ISIDRO,tos,,Socota
94113582,Yolanda David Flores Rodríguez,2002-04-15,M,,"picazón, estornudos",Alergia,Socota
58027168,Patricia Mónica González Rojas,1998-03-11,F,CASERIO SAN JOSE,picazón,Diabetes,Socota
20114764,José Sara Pérez Silva,2013-12-17,M,SAN JOSE DE LIRIO,"estornudos, picazón",Alergia,Socota
38462407,Carlos Natalia Rojas Mendoza,1966-03-17,M,CASERIO SANTA RITA,"dolor de garganta, fiebre, tos",Gripe,Socota
34499049,Verónica Pablo Cruz García,1999-07-19,M,CASERIO EL CUMBE,"visión borrosa, mareos",Hipertensión,Socota
23721721,María Diego López Torres,1972-02-12,M,VISTA ALEGRE,"náuseas, sensibilidad a la luz, dolor de cabeza",Migraña,Socota
24060641,Miguel Martínez Pérez,2005-07-29,M,CP.EL CUMBE,picazón,Diabetes,Socota
34593985,Lucía Carolina García Cruz,2006-06-01,M,CASERIO PUQUIO,,,Socota
40542361,Jesús Alberto Castillo Rojas,1996-10-18,M,OTRO OTRO NRO.SN BLOQUE. PISO.01 INTERIOR.  MZA.  LOTE.,"náuseas, acidez estomacal, dolor abdominal",Gastritis,Socota
56993936,Luis Mónica González Delgado,1966-06-26,M,SAN ISIDRO,"náuseas, dolor abdominal",Gripe,Socota
86800857,Jesús Marco Gutiérrez Flores,1996-01-24,F,CHURAZ,"fiebre, dolor de garganta, congestión nasal",Gripe,Socota
64239737,Lucía Luisa Mendoza Torres,1998-08-07,M,BATANCILLO,"ojos llorosos, picazón, estornudos",Alergia,Socota
59201480,Lucía Claudia Pérez Flores,2004-08-02,M,CUCHEA NOGAL,"sed excesiva, micción frecuente",Diabetes,Socota
66992042,Ángel Luisa Flores López,1972-08-29,F,CALLAYUC,,COVID-19,Socota
88135725,Rosa Gloria Castillo García,2013-04-03,F,SAN AGUSTIN,"micción frecuente, cansancio",Diabetes,Socota
41485147,Jorge David García Delgado,1989-02-05,M,OTRO. SECTOR LA PALMA NRO. PUERTA SN PISO.01,"dolor de cabeza, visión borrosa, mareos",Hipertensión,Socota
41600443,Lucía Olga Rojas López,1974-09-08,M,EL CUMBE,"opresión en el pecho, sibilancias",Asma,Socota
74405161,María Héctor Flores García,1983-07-28,F,OTRO. UNION SAN JOSE NRO. PUERTA SN PISO.01,"tos, dolor de garganta",Gripe,Socota
27343479,Luis Luisa García Pérez,2000-12-25,F,OTRO. PACCHA MIRAFLORES NRO. PUERTA SN PISO.01,"mareos, dolor de cabeza, visión borrosa",Hipertensión,Socota
12499802,Lucía Luisa Ramírez Paredes,2010-07-16,F,EL CUMBE,,,Socota
50293555,Yolanda Gloria Pérez Flores,2015-08-19,F,OTRO. SAN ISIDRO NRO. PUERTA SN PISO.01,"cansancio, sed excesiva",Diabetes,Socota
94776657,Lucía Roberto Cruz Vargas,1948-02-08,M,CASERIO CHURAZ,"dolor de cabeza, sensibilidad a la luz",Migraña,Socota
51824696,Jorge Mónica García Castillo,1998-04-07,M,VILUCO,"acidez estomacal, dolor abdominal",Gastritis,Socota
32709178,Verónica Marco García Gutiérrez,2007-02-05,F,chontas bajas,"mareos, visión borrosa",Hipertensión,Socota
28214719,Luis Raúl Silva López,1998-07-14,F,VILUCO,"sed excesiva, micción frecuente",Diabetes,Socota
13873353,Sandra Luisa García Ramírez,2017-12-16,M,OTRO. TOCHEPAMPA NRO. PUERTA SN PISO.01,"náuseas, dolor abdominal, acidez estomacal",Gastritis,Socota
90614321,Fernando Laura Castillo Rodríguez,1973-05-20,M,CASERIO TOCHE PAMPA,"dificultad para respirar, sibilancias",Asma,Socota
79124938,Jesús Natalia López Paredes,2008-11-18,F,EL SALLOC,"fiebre, tos, dolor de garganta",Gripe,Socota
16511766,Lucía Gloria Sánchez Rodríguez,1956-08-22,M,OTRO TROCHA CARROZABLE SN   PISO  1    KM   70,,Gripe,Socota
86850586,Lucía David Gutiérrez Delgado,2016-12-03,F,OTRO. BATANCILLO NRO. PUERTA SN PISO.01,"dolor de cabeza, visión borrosa, mareos",Hipertensión,Socota
30844641,Carlos Marco Sánchez Paredes,1967-08-22,M,CASERIO SAN JOSE DE LIRIO,"visión borrosa, mareos",Hipertensión,Socota
25635362,Marta Gloria Martínez González,1980-05-01,M,SAN JUAN DE CHORRILLOS,"dolor de cabeza, mareos, visión borrosa",Hipertensión,Socota
47464313,Sandra Mónica Delgado González,1960-04-06,M,CP.EL CUMBE,"fiebre, dificultad para respirar, tos seca",COVID-19,Socota
82562389,Carmen Laura Herrera Cruz,2021-02-22,F,CASERIO PUQUIO,"opresión en el pecho, sibilancias, dificultad para respirar",Asma,Socota
99727285,María Luisa Ramírez Sánchez,2009-06-18,F,CALLE SAENZ PEÑA SN,"dolor de cabeza, náuseas, sensibilidad a la luz",Migraña,Socota
60796265,Fernando Natalia Sánchez Torres,1980-08-12,F,CALLAYUC,"sibilancias, opresión en el pecho, dificultad para respirar",Asma,Socota
25094063,Marta Alberto Delgado Mendoza,2006-03-21,M,CASERIO LA PACCHA MIRAFLORES,"picazón, ojos llorosos, estornudos",Alergia,Socota
41409310,María Laura García Vargas,2000-10-02,F,EL CUMBE,"micción frecuente, cansancio, sed excesiva",Diabetes,Socota
23176572,Marta Sara Silva Flores,2012-02-24,F,CASERIO PACCHA,"cansancio, sed excesiva",Diabetes,Socota
58806791,Patricia Natalia López García,1978-08-28,M,CRR. AL CUMBE SN   PISO 01,"sibilancias, opresión en el pecho, dificultad para respirar",Asma,Socota
37065450,Marta Marco Paredes González,1988-08-29,M,PJ. EL LIMON NRO. PUERTA SN PISO.01,"estornudos, picazón, ojos llorosos",Alergia,Socota
61173644,Juan Mónica Silva Rodríguez,2006-03-30,F,C.P.EL CUMBE,sibilancias,Diabetes,Socota
37317511,Carlos Natalia Rodríguez Vargas,2003-10-22,M,CALLAYUC,"acidez estomacal, dolor abdominal",Gastritis,Socota
96527798,Carlos Diego González Herrera,1955-04-12,M,OTRO CAMINO A MERENDANA SN   PISO 01,náuseas,Migraña,Socota
89633755,Verónica Eduardo Silva Rodríguez,2021-10-20,F,caserio san jose de lirio,"sensibilidad a la luz, dolor de cabeza",Migraña,Socota
86511501,María Sara Herrera Castillo,1956-03-17,M,CASERIO SAN JOSE,"micción frecuente, cansancio",Diabetes,Socota
43637122,Marta Alberto Sánchez Flores,1984-11-28,F,QUEROMARCA,"dificultad para respirar, fiebre, pérdida de olfato",COVID-19,Socota
27587885,Patricia Carolina Torres Mendoza,1965-02-14,F,CASERIO CHURAZ,"ojos llorosos, estornudos",Alergia,Socota
90759927,Marta Olga Rodríguez Rojas,2012-05-30,F,YAPANA,"fiebre, pérdida de olfato, tos seca",COVID-19,Socota
27902357,Luis David Sánchez Vargas,1991-08-15,M,AV. VISTA ALEGRE NRO. PUERTA SN PISO.01,"acidez estomacal, náuseas, dolor abdominal",Gastritis,Socota
74376312,Patricia Mónica Pérez Rojas,1977-02-15,F,OTRO. CHORRILLOS NRO. PUERTA SN PISO.01,,Migraña,Socota
53391403,Pedro Carolina López Mendoza,2008-10-17,F,COMUNIDAD SAN ISIDRO,"dificultad para respirar, sibilancias",Asma,Socota
10178643,Luis Eduardo Torres Mendoza,1974-03-27,M,CASERIO LA UNION,acidez estomacal,Gastritis,Socota
41959548,Pedro Pablo Rodríguez Mendoza,1997-03-14,M,CASERIO LA PACCHA,"visión borrosa, dolor de cabeza",Migraña,Socota
51261708,María Carolina Torres Rodríguez,1974-12-13,F,EL CUMBE,"visión borrosa, mareos, dolor de cabeza",Hipertensión,Socota
63999884,Yolanda Mónica López Ramírez,2015-05-21,M,CASERIO YAPANA,"picazón, ojos llorosos, estornudos",Alergia,Socota
92513021,María Sara Cruz Mendoza,1974-04-16,M,CASERIO VILUCO,"micción frecuente, cansancio",Diabetes,Socota
59848410,José Carolina Mendoza Rodríguez,2015-02-06,F,CASERIO CUCHEA,"ojos llorosos, picazón",Asma,Socota
35996201,Marta Luisa Herrera Vargas,2019-03-17,M,OTRO. SAN JOSE NRO. PUERTA SN PISO.01,,,Socota
57350079,Carlos David González Flores,2001-03-31,M,CHONTAS ALTAS,"visión borrosa, mareos",Hipertensión,Socota
54309638,Lucía Carolina Vargas Herrera,2013-06-04,M,CASERIO SAN JOSE DE LIRIO,,,Socota
30566813,Juan Roberto Cruz Martínez,1998-04-07,M,VILUCO,"acidez estomacal, dolor abdominal",Gastritis,Socota
65445030,Luis Claudia González Pérez,2003-12-12,F,LLANGUA,,,Socota
57105285,María Roberto Rojas Castillo,1994-04-29,M,CASERIO PACCHA,"acidez estomacal, dolor abdominal, náuseas",Gastritis,Socota
25472092,Fernando Olga Gutiérrez López,1998-01-27,F,CASERIO NUEVA PIURITA,"visión borrosa, mareos",Hipertensión,Socota
44970901,Patricia Marco González Delgado,1978-10-18,M,CALLAYUC,"estornudos, picazón, ojos llorosos",Alergia,Socota
41032368,Pedro Sara Pérez Sánchez,1994-12-10,F,CASERIO SAN JUAN BAUTISTA,"cansancio, micción frecuente",Diabetes,Socota
92260311,María Olga Herrera Pérez,2016-08-23,F,OTRO. CHURAZ NRO. PUERTA SN PISO.01,"dificultad para respirar, tos seca, pérdida de olfato",COVID-19,Socota
31306270,Pedro Diego González Rojas,2013-09-23,F,OTRO HUARTILLAS NRO.SN BLOQUE. PISO.01 INTERIOR.  MZA.  LOTE.,,,Socota
24459510,Rosa Natalia Rodríguez Martínez,2017-02-17,M,OTRO. PUQUIO NRO. PUERTA SN PISO.1,"mareos, visión borrosa",Hipertensión,Socota
19348363,Lucía Pablo Ramírez Silva,2001-12-01,F,CHONTA ALTA,"visión borrosa, dolor de cabeza, mareos",Hipertensión,Socota
69207711,Rosa Carolina Silva Torres,2000-07-24,M,CASERIO EL PORVENIR,"cansancio, sed excesiva, micción frecuente",Diabetes,Socota
70388268,María Eduardo García Pérez,1974-10-20,F,PORVENIR,"dolor de garganta, congestión nasal, fiebre",Gripe,Socota
49769267,Ana Carolina Torres Paredes,2009-05-19,M,SANTA FE,"picazón, ojos llorosos",Alergia,Socota
25565096,Miguel Laura González Herrera,1981-12-10,F,CUCHEA,"náuseas, dolor abdominal",Gastritis,Socota
58059110,Marta Natalia Gutiérrez Ramírez,1997-01-24,F,EL CUMBE,ojos llorosos,Gripe,Socota
88587083,Rosa Raúl Martínez López,1958-08-06,M,PUQUIO,dolor de cabeza,,Socota
58075609,Patricia Pablo García Flores,1985-08-10,M,CASERIO CHONTAS BAJAS,,,Socota
42384825,Patricia Sara González Martínez,1995-05-22,M,EL CUMBE,,,Socota
93545369,Pedro Luisa Silva López,1975-01-02,M,CASERIO CHURAZ,congestión nasal,Diabetes,Socota
37089324,Fernando Natalia López Martínez,1994-09-29,M,CASERIO CHURAZ,"dificultad para respirar, tos seca, pérdida de olfato",COVID-19,Socota
34310615,Marta Olga Castillo Herrera,1955-01-20,M,GRAMALOTILLO,"opresión en el pecho, sibilancias, dificultad para respirar",Asma,Socota
19559153,Ángel Roberto García Martínez,2001-02-12,F,SAN JUAN BAUTISTA,"micción frecuente, cansancio, sed excesiva",Diabetes,Socota
90599181,Sandra Eduardo Rodríguez Delgado,2021-10-27,M,CSERIO GRAMALOTILLO,"visión borrosa, dolor de cabeza",Hipertensión,Socota
17336873,Carmen Diego Paredes Delgado,2008-11-22,M,CHURAZ,"opresión en el pecho, sibilancias, dificultad para respirar",Asma,Socota
56244572,Miguel Gloria Ramírez Rodríguez,2019-06-28,M,CASERIO FILADELFIA,,Migraña,Socota
20222791,Ana Alberto González Mendoza,2007-02-07,M,CHONTAS,"opresión en el pecho, dificultad para respirar",Asma,Socota
79111626,Ángel Mónica López Delgado,2000-01-24,F,OTRO. INGUER NRO. PUERTA SN PISO.01,"micción frecuente, cansancio",Diabetes,Socota
86578170,Verónica Luisa Sánchez Torres,1966-11-01,M,SAN JOSE,"opresión en el pecho, sibilancias",Asma,Socota
65444187,Patricia Gloria Pérez Ramírez,1961-07-03,M,SAN JOSE DE LIRIO,"dificultad para respirar, sibilancias, opresión en el pecho",Asma,Socota
60852824,Juan Luisa González García,2014-02-18,F,SAN ISIDRO,"visión borrosa, mareos",Hipertensión,Socota
74682065,Lucía Eduardo Rojas Vargas,1969-08-15,F,CALLAYUC,dolor de cabeza,Gastritis,Socota
46700575,Ana Eduardo Pérez Flores,2001-08-01,F,OTRO. SN NRO. PUERTA SN PISO.01,"micción frecuente, cansancio",Diabetes,Socota
93311041,Luis Mónica Ramírez Torres,1988-03-18,M,OTRO. SECTOR GRANADILLO NRO. PUERTA SN PISO.01,"estornudos, picazón",Gripe,Socota
92889729,Luis Laura Paredes Flores,2012-02-04,M,SANTA RITA,náuseas,Alergia,Socota
96623550,Ángel Natalia Rodríguez González,2009-03-08,F,CHURAZ,"sibilancias, opresión en el pecho, dificultad para respirar",Asma,Socota
25086676,María Héctor González Ramírez,1999-05-01,F,CHURAZ,opresión en el pecho,Diabetes,Socota
31281143,Carlos Laura López Vargas,1961-02-12,M,,"opresión en el pecho, dificultad para respirar",Asma,Socota
16606328,Yolanda Isabel Cruz Delgado,1976-05-08,M,CASERIO CHURAZ,"ojos llorosos, estornudos",Gastritis,Socota
71796792,Yolanda Mónica González Paredes,1979-10-25,F,OTRO YAPANA NRO.SN BLOQUE. PISO.01 INTERIOR.  MZA.  LOTE.,"congestión nasal, tos",Gripe,Socota
63200371,Ángel Gloria Rojas Cruz,1998-10-09,M,OTRO. UNION SAN JOSE NRO. PUERTA SN PISO.01,"dolor de cabeza, sensibilidad a la luz",Migraña,Socota
72758111,Carlos Raúl Gutiérrez Herrera,1972-05-01,F,OTRO. FILADELFIA NRO. PUERTA SN PISO.01,"tos seca, dificultad para respirar, fiebre",COVID-19,Socota
62575636,Fernando Laura Paredes Martínez,1994-06-05,F,OTRO. CHORRILLOS NRO. PUERTA SN PISO.02,opresión en el pecho,Asma,Socota
66974341,Verónica Carolina Sánchez González,2014-09-12,F,SAN JUAN DE CHORRILLOS,"sed excesiva, micción frecuente, cansancio",Diabetes,Socota
98157289,Sandra Luisa López Rojas,1988-07-12,F,CASERIO SAN JOSE,"estornudos, picazón, ojos llorosos",Alergia,Socota
54283016,Jesús Sánchez Rojas,1964-01-02,M,EL CUMBE,"tos, fiebre, congestión nasal",Gripe,Socota
72591773,Carmen Gloria Silva Vargas,2010-04-22,M,CASERIO CHONTAS ALTAS,"dolor abdominal, náuseas, acidez estomacal",Gastritis,Socota
45226219,Pedro Eduardo Delgado Herrera,2003-06-15,M,CALLE 5 670,"visión borrosa, mareos",Hipertensión,Socota
43341376,Sandra David Cruz Sánchez,2011-01-28,M,LLANGUA,"cansancio, micción frecuente",Diabetes,Socota
88133212,Jorge Laura Mendoza Vargas,1966-07-25,F,CHURAZ,"fiebre, dolor de garganta",Gripe,Socota
77835677,Patricia David Cruz Torres,1980-05-30,F,EL CUMBE,"dolor de cabeza, náuseas, sensibilidad a la luz",Migraña,Socota
75544476,Fernando Marco Rodríguez Flores,1972-09-29,F,YAPANA,"acidez estomacal, náuseas",Gastritis,Socota
95105706,Jorge Andrés Castillo Cruz,1998-06-30,F,CASERIO CUCHEA,"mareos, visión borrosa",Hipertensión,Socota
28133035,María Marco Ramírez Rojas,2009-04-03,F,CASERIO LA PACCHA MIRAFLORES,"acidez estomacal, dolor abdominal, náuseas",Gastritis,Socota
13037688,Luis Luisa Ramírez Sánchez,1989-03-20,F,SAN JUAN BAUTISTA,"opresión en el pecho, sibilancias",Asma,Socota
64282999,María Raúl Paredes Sánchez,1998-04-01,F,CERCADO CALLAYUC,,,Socota
67108618,Ana Isabel Delgado Mendoza,2002-04-08,M,CASERIO CHONTAS BAJAS,"dificultad para respirar, fiebre",Gripe,Socota
86972394,Pedro Pablo Vargas González,2004-10-20,M,CASERIO SAN JOSE DE LIRIO,"estornudos, ojos llorosos, picazón",Alergia,Socota
48483769,Ana Claudia Cruz Sánchez,1979-12-25,M,CHURAZ,"opresión en el pecho, sibilancias",Asma,Socota
65971477,Jesús Laura Flores Herrera,2000-09-05,F,PUQUIO,"dificultad para respirar, opresión en el pecho",Asma,Socota
54462487,Yolanda Marco Cruz Pérez,2008-07-20,F,SAN JUAN DE CHORRILLOS,"dolor de garganta, congestión nasal",Hipertensión,Socota
67509289,María Andrés Castillo Torres,2009-01-11,F,YAPANA,"sibilancias, opresión en el pecho",Asma,Socota
73498672,Lucía Delgado González,1993-01-19,F,CASERIO YAPANA,"opresión en el pecho, dificultad para respirar, sibilancias",Asma,Socota
40106749,Jesús Sara Silva Castillo,2023-07-03,M,SANTA RITA,"acidez estomacal, náuseas, dolor abdominal",Gastritis,Socota
38515877,Ángel Luisa González Martínez,1965-02-20,F,VISTA ALEGRE,"sensibilidad a la luz, náuseas, dolor de cabeza",Migraña,Socota
32593524,Jorge Luisa Rojas Sánchez,1976-04-07,M,VILUCO,"ojos llorosos, picazón",Gastritis,Socota
66920360,Verónica Olga Mendoza Herrera,1939-03-11,M,CP.EL CUMBE,dolor abdominal,Gastritis,Socota
97062336,Marta Carolina García López,1965-05-15,M,C.P.EL CUMBE,,Hipertensión,Socota
75974234,Fernando Mónica Gutiérrez López,1998-04-01,F,OTRO SAN JOSE NRO.SN BLOQUE. PISO.01 INTERIOR.  MZA.  LOTE. KM.,"dolor de cabeza, mareos, visión borrosa",Hipertensión,Socota
30424028,Sandra Pablo López Herrera,2003-05-28,M,OTRO. SANTA CLARA NRO. PUERTA SN PISO.01,"estornudos, picazón",Alergia,Socota
99319466,Carmen Carolina Silva Mendoza,1998-08-15,F,SAN JOSE DE LIRIO,"sensibilidad a la luz, dolor de cabeza, náuseas",Migraña,Socota
83561603,Pedro Carolina García Vargas,2018-11-08,F,OTRO. SAN JOSE DE LIRIO NRO. PUERTA SN PISO.01,"ojos llorosos, picazón, estornudos",Alergia,Socota
86442893,Miguel Natalia Rodríguez Flores,1966-12-16,F,SAN JUAN DE CHORRILLOS,,,Socota
44933732,Ángel Eduardo Torres Rojas,1958-08-15,M,EL CUMBE,dolor abdominal,Asma,Socota
95491936,Ana Olga García Vargas,1994-12-20,F,OTRO CUMBE NRO.SN BLOQUE. PISO.01 INTERIOR.  MZA.  LOTE.,"dolor de cabeza, náuseas, sensibilidad a la luz",Migraña,Socota
66382542,Verónica Raúl Cruz Rojas,2006-01-04,F,CP EL CUMBE,"estornudos, ojos llorosos",Alergia,Socota
81877836,Ángel Pablo López Ramírez,1963-04-09,F,CALLAYUC,,,Socota
41796662,Ángel Gloria Paredes Vargas,1999-02-20,M,CASERIO MERENDANA,"dolor de garganta, congestión nasal",Gripe,Socota
94390916,Jorge David López Pérez,1968-09-27,F,EL CUMBE,"sensibilidad a la luz, dolor de cabeza",Migraña,Socota
46465250,María Sánchez Cruz,2016-10-16,F,OTRO. SAN JOSE NRO. PUERTA SN PISO.02,"dificultad para respirar, sibilancias",Asma,Socota
16582227,Jesús Diego Castillo Rojas,2020-11-16,M,OTRO LA JALCA NRO.SN BLOQUE. PISO.01 INTERIOR.  MZA.  LOTE.,"tos seca, dificultad para respirar, pérdida de olfato",COVID-19,Socota
43836486,Carmen Roberto Ramírez Flores,2002-01-04,F,CASERIO SAN JOSE,"sed excesiva, micción frecuente, cansancio",Diabetes,Socota
83064900,José Pablo Rojas Martínez,1991-12-15,M,CASERIO YAPANA,"dolor de cabeza, náuseas",Migraña,Socota
68704640,Jorge Alberto Mendoza Vargas,1969-11-03,M,,"náuseas, dolor de cabeza, sensibilidad a la luz",Migraña,Socota
12082912,Jorge Natalia Rojas Gutiérrez,1984-02-14,F,SAN JOSE DE LIRIO,"micción frecuente, cansancio",Diabetes,Socota
77915806,Ángel Pablo Torres González,1980-08-15,M,CASERIO YAPANA,tos,Asma,Socota
86950769,Sandra Luisa Castillo Mendoza,1947-10-14,M,SAN ISIDRO,tos,,Socota
13084139,Ana Raúl Paredes Gutiérrez,2017-09-26,M,CALLE. CHONTAS NRO. PUERTA SN PISO.01,tos,,Socota
60912917,Lucía Mónica Martínez Mendoza,1986-10-21,F,CALLAYUC,"picazón, estornudos, ojos llorosos",Alergia,Socota
29900798,Pedro Marco Silva Rojas,2012-07-27,M,SANTA FE,"mareos, dolor de cabeza",Hipertensión,Socota
40481382,Luis Claudia Flores Sánchez,1987-07-26,M,EL CUMBE,"tos, fiebre",Gripe,Socota
94508488,Yolanda Marco Pérez García,2003-05-08,M,OTRO. HUERTILLAS NRO. PUERTA SN PISO.01,"náuseas, acidez estomacal",Gastritis,Socota
54942497,Carlos Alberto Gutiérrez Vargas,2023-12-03,M,SAN ISIDRO,"pérdida de olfato, fiebre, dificultad para respirar",COVID-19,Socota
37618244,Verónica Héctor Delgado Vargas,1990-12-19,F,SANTA RITA,"micción frecuente, cansancio",Diabetes,Socota
19740430,Luis Pablo García Mendoza,2015-06-12,F,OTRO. CHURAZ NRO. PUERTA SN PISO.01,"dolor de cabeza, sensibilidad a la luz",Migraña,Socota
66842136,Sandra Eduardo Torres Rojas,2008-10-13,F,CHONTAS ALTAS,,,Socota
14653751,Jesús Claudia Herrera Sánchez,1953-05-22,M,PACCHA,"sensibilidad a la luz, náuseas",Migraña,Socota
30105332,Sandra Natalia Paredes Mendoza,1989-08-16,M,OTRO SECTOR DEL CAMPO NRO.SN BLOQUE. PISO.01 INTERIOR.  MZA.  LOTE.,dolor de cabeza,,Socota
68930244,Verónica Andrés Ramírez Castillo,1998-04-21,F,San José de lirio,"sibilancias, opresión en el pecho",Asma,Socota
46051437,Marta Pablo Flores Torres,2003-09-10,F,CASERIO MERENDANA,"ojos llorosos, picazón, estornudos",Alergia,Socota
97276956,Ana Sara García Paredes,1991-12-25,M,OTRO. FILADELFIA NRO. PUERTA SN PISO.01,pérdida de olfato,Asma,Socota
46599443,Jorge David Castillo Flores,2016-05-13,F,CASERIO CHONTAS ALTAS,"micción frecuente, sed excesiva, cansancio",Diabetes,Socota
71103580,Carlos David Pérez Torres,1971-08-19,F,CUCHEA,"tos, congestión nasal",Gripe,Socota
84392119,Jesús Marco Torres Herrera,1960-05-21,F,CUCHEA,picazón,Gripe,Socota
52902844,José Eduardo Flores García,2015-05-01,F,CHONTAS BAJAS,"picazón, estornudos, ojos llorosos",Alergia,Socota
48638529,Pedro Diego Torres Martínez,1986-12-25,M,CASERIO CUCHEA,"visión borrosa, mareos",Hipertensión,Socota
92193051,Miguel David Herrera Cruz,2016-10-24,M,OTRO. SANTA TERESA DE QUEROMARCA NRO. PUERTA SN PISO.01,"náuseas, dolor de cabeza",Migraña,Socota
78525872,Sandra Olga Cruz Mendoza,2016-03-26,F,CPM EL CUMBE,"ojos llorosos, estornudos",Migraña,Socota
36112207,Ángel Eduardo Gutiérrez Silva,2022-04-11,M,SAN JOSE DE LIRIO,"pérdida de olfato, tos seca, dificultad para respirar",COVID-19,Socota
17541160,Verónica Olga Flores Paredes,1965-12-25,M,CHONTAS ALTAS,"dolor de cabeza, mareos",Asma,Socota
17434839,María Claudia Ramírez Cruz,1962-02-28,F,OTRO PERLAMAYO NRO.SN BLOQUE. PISO.01 INTERIOR.  MZA.  LOTE. km.,"tos seca, pérdida de olfato",COVID-19,Socota
83982868,Ángel Pablo Rodríguez García,1972-07-10,F,SAN JOSE DE LIRIO,"pérdida de olfato, tos seca, dificultad para respirar",COVID-19,Socota
41538471,Yolanda Pablo Herrera Sánchez,2017-01-26,M,OTRO. SANTA ROSA NRO. PUERTA SN PISO.01,"acidez estomacal, náuseas",Gastritis,Socota
27244076,Rosa Sara García Sánchez,1992-04-28,F,OTRO. FILADELFIA NRO. PUERTA SN PISO.01,"mareos, visión borrosa",Hipertensión,Socota
86657211,Carlos Andrés Gutiérrez Cruz,1981-04-05,F,SAN ISIDRO,"náuseas, dolor abdominal",Gastritis,Socota
12444327,Verónica Olga Castillo López,1997-10-22,M,CASERIO CHURAZ,"dificultad para respirar, opresión en el pecho",Asma,Socota
39399427,Carlos Sara García Mendoza,2018-10-18,F,OTRO. SN NRO. PUERTA SN PISO.01,"pérdida de olfato, fiebre",COVID-19,Socota
74529018,Jesús Diego García Castillo,2005-12-29,M,CASERIO YAPANA,"congestión nasal, fiebre",Gripe,Socota
38806041,Carlos Isabel Delgado Cruz,1950-05-03,M,PIURITA,dolor de cabeza,Gripe,Socota
21963658,María Andrés Mendoza Pérez,2010-02-28,F,CHURAZ,dolor de cabeza,,Socota
62387755,José Eduardo Paredes Delgado,1998-01-03,M,OTRO. YAPANA NRO. PUERTA SN PISO.01,"congestión nasal, dolor de garganta",Migraña,Socota
16969715,Marta Raúl Delgado Silva,2000-08-04,M,CALLAYUC,"sed excesiva, micción frecuente, cansancio",Diabetes,Socota
83878548,José David López González,2003-04-26,F,CASERIO SANTA RITA,"estornudos, ojos llorosos, picazón",Alergia,Socota
62610388,Juan Diego Vargas Ramírez,2012-07-01,M,CASERIO SAN JUAN DE CHORRILLOS,"dificultad para respirar, tos seca, pérdida de olfato",COVID-19,Socota
89824580,Patricia Laura Pérez Cruz,1969-12-05,M,CASERIO SAN JOSE,"cansancio, sed excesiva",Diabetes,Socota
19026970,Juan Alberto López Martínez,2014-01-03,M,CALLAYUC,"dificultad para respirar, opresión en el pecho, sibilancias",Asma,Socota
82888129,Pedro Eduardo Rodríguez Martínez,1969-06-30,F,C.P.EL CUMBE,"visión borrosa, dolor de cabeza, mareos",Hipertensión,Socota
92726382,Luis Marco Rojas Martínez,1997-12-20,F,SAN JOSE DE LIRIO,"picazón, ojos llorosos, estornudos",Alergia,Socota
48435104,Patricia Andrés García Paredes,2009-08-20,F,JR ALFONSO UGARTE 100,opresión en el pecho,Hipertensión,Socota
32920811,Jorge Alberto Castillo García,2018-01-02,M,CARR. CALLAYUC NRO. PUERTA SN PISO.01,fiebre,,Socota
10687074,Pedro Alberto Torres Castillo,1960-05-16,F,EL CUMBE,tos seca,Hipertensión,Socota
91929290,Fernando Mónica Rodríguez Martínez,2008-03-31,M,OTRO SANTA RITA NRO.SN BLOQUE. PISO.01 INTERIOR.  MZA.  LOTE.,"fiebre, pérdida de olfato, tos seca",COVID-19,Socota
17519179,María Héctor Pérez Delgado,2012-10-21,M,gramalotillo,"visión borrosa, mareos",Diabetes,Socota
81443093,Verónica Raúl Sánchez González,1983-02-01,F,FILADELFIA,"dolor abdominal, náuseas",Gastritis,Socota
80213629,Ángel Isabel García Silva,1986-08-20,F,CASERIO SANTA FE,"mareos, dolor de cabeza",Hipertensión,Socota
27239721,Carmen Mónica Silva Castillo,1960-08-02,M,HUABAL,,Gastritis,Socota
93897068,Carmen Isabel Cruz Silva,1962-02-22,F,CALLAYUC,"opresión en el pecho, dificultad para respirar",Migraña,Socota
82039939,Carmen Raúl Silva Vargas,1972-04-14,M,CASERIO CUCHEA,"sed excesiva, cansancio, micción frecuente",Diabetes,Socota
85105019,Yolanda Roberto Castillo Cruz,2024-07-20,F,CASERIO  EL  PORVENIR,"micción frecuente, sed excesiva, cansancio",Diabetes,Socota
69105074,Rosa Luisa Gutiérrez García,1989-11-10,M,JR. SAENS PEÑA NRO. PUERTA SN PISO.01,"sed excesiva, cansancio, micción frecuente",Diabetes,Socota
95742644,Carmen Isabel Gutiérrez Sánchez,1993-07-05,F,CASERIO CHURAZ,"náuseas, acidez estomacal",Gastritis,Socota
53074624,Luis Héctor Herrera Pérez,1989-11-11,M,CASERIO CUCHEA,"picazón, estornudos",Alergia,Socota
62860216,Luis López Herrera,2021-12-21,F,CAJAMARCA - CUTERVO,"congestión nasal, fiebre",Migraña,Socota
69725229,Lucía Diego Herrera Silva,1992-12-29,M,OTRO VILUCO NRO.SN BLOQUE. PISO.01 INTERIOR.  MZA.  LOTE.,náuseas,Asma,Socota
88817739,Miguel Carolina González Pérez,2015-06-23,F,OTRO. CARRETERA A MERENDANA NRO. PUERTA SN PISO.02,fiebre,Gripe,Socota
55008450,María Roberto Mendoza Torres,2021-08-19,F,CALLAYUC,"opresión en el pecho, sibilancias, dificultad para respirar",Asma,Socota
48921900,Marta Alberto Rojas Herrera,2001-02-25,M,OTRO. SAN JOSE NRO. PUERTA SN PISO.02,sed excesiva,Migraña,Socota
81444477,Carlos Raúl Pérez García,1999-10-03,F,CASERIO SAN ISIDRO,"sed excesiva, cansancio, micción frecuente",Diabetes,Socota
54096066,Jorge Pablo Vargas Sánchez,2021-12-01,F,CASERIO SAN JOSE DE LIRIO,,Gripe,Socota
42386335,Ana Laura Pérez Rodríguez,2008-10-24,F,EL PORVENIR,,Migraña,Socota
27847182,Pedro Marco Vargas Sánchez,2018-07-28,F,OTRO SAN JUAN BAUTISTA NRO.SN BLOQUE. PISO.02 INTERIOR.  MZA.  LOTE. KM.,"acidez estomacal, dolor abdominal, náuseas",Gastritis,Socota
28216522,Rosa Natalia Delgado Pérez,1987-04-25,M,OTRO. SAN JOSE NRO. PUERTA SN PISO.01,"picazón, estornudos",Alergia,Socota
68770304,Sandra Natalia Castillo Mendoza,1992-01-01,M,CASERIO CHURAZ,"dolor de cabeza, visión borrosa, mareos",Hipertensión,Socota
23345932,Jesús Natalia Herrera Rojas,2022-07-26,M,CALLAYUC,,,Socota
