DNI,Asegurado,FecNac,SEXO,CPP,síntomas,enfermedad detectada,Distrito
64625138,Jesús Isabel Martínez Silva,2002-08-17,F,OTRO. COSTADO DE LA PRIMARIA NRO. PUERTA SN PISO.01,"opresión en el pecho, sibilancias",Asma,Socota
43288502,María Raúl Sánchez Paredes,2024-06-01,F,SAN JUAN BAUTISTA,"náuseas, sensibilidad a la luz, dolor de cabeza",Migraña,Socota
95502034,Carlos Isabel Ramírez Sánchez,2003-08-12,M,CASERIO SAN ISIDRO,,,Socota
55621121,Jorge Natalia Mendoza Ramírez,1995-08-14,M,JR. SAENS PEÑA NRO. PUERTA SN PISO.01,"sensibilidad a la luz, dolor de cabeza",Migraña,Socota
92635998,Fernando Claudia Torres Martínez,2015-05-22,F,OTRO. SN NRO. PUERTA SN PISO.01,,,Socota
77151641,Rosa Diego Rojas Martínez,2006-02-24,M,CHONTAS BAJAS,,,Socota
45128741,Patricia Eduardo Mendoza Cruz,2005-11-18,M,JIRON PAMPA DEL CHINE,"micción frecuente, sed excesiva",Diabetes,Socota
97776552,Verónica Diego Paredes Silva,1995-04-30,F,CASERIO YAPANA,"dolor de cabeza, náuseas, sensibilidad a la luz",Migraña,Socota
37095669,María Luisa González Martínez,1945-09-25,F,CALLAYUC,"opresión en el pecho, sibilancias",Asma,Socota
54836865,Fernando Eduardo Rodríguez Pérez,1995-03-17,F,OTRO CHORRILLOS NRO.SN BLOQUE. PISO.02 INTERIOR.  MZA.  LOTE. KM.,"fiebre, pérdida de olfato, dificultad para respirar",COVID-19,Socota
69616703,Sandra Alberto Paredes Flores,1977-02-21,F,OTRO SECTOR LA BALSA NRO.SN BLOQUE. PISO.02 INTERIOR.  MZA.  LOTE. km.,"mareos, dolor de cabeza, visión borrosa",Hipertensión,Socota
59262492,Rosa Olga Pérez Torres,1969-09-09,F,CASERIO SAN JOSE,sibilancias,Diabetes,Socota
20237092,Jorge Mónica Martínez Mendoza,2021-07-10,M,CASERIO CUCHEA,,,Socota
69203048,Fernando Claudia Torres Ramírez,1994-12-16,M,CARR. LA LIBERTAD NRO. PUERTA SN PISO.01,,Asma,Socota
14258715,Lucía Laura Rojas Gutiérrez,1964-10-27,F,EL CUMBE,"acidez estomacal, náuseas",Gastritis,Socota
41361976,José Natalia González Silva,1992-06-25,M,CASERIO CUCHEA,dificultad para respirar,Alergia,Socota
84258037,Patricia Silva Paredes,2016-12-06,M,OTRO CALLAYUC NRO.SN BLOQUE. PISO.01 INTERIOR.  MZA.  LOTE.,"picazón, ojos llorosos",Alergia,Socota
95102756,Carmen Carolina Torres Paredes,1957-02-12,F,CUCHEA,"fiebre, dolor de garganta",Gripe,Socota
44672185,Rosa Mónica Flores Pérez,2011-10-03,M,CASERIO SAN JOSE,"dolor abdominal, acidez estomacal, náuseas",Gastritis,Socota
19354081,Ángel Claudia Castillo García,2017-02-08,F,OTRO. MATARA NRO. PUERTA SN PISO.01,"dolor abdominal, náuseas, acidez estomacal",Gastritis,Socota
81739460,Patricia Roberto Torres González,2004-09-23,F,CASERIO VISTA ALEGRE,"cansancio, sed excesiva, micción frecuente",Diabetes,Socota
55047570,Carmen Isabel López González,2024-07-18,M,CALLAYUC,"mareos, visión borrosa, dolor de cabeza",Hipertensión,Socota
24686361,Sandra Andrés Herrera Silva,1951-05-09,F,CALLAYUC,,,Socota
82131877,Patricia David Rojas Vargas,1991-06-01,M,SAN JOSE,"dificultad para respirar, opresión en el pecho",Asma,Socota
49358816,Marta Marco Flores Delgado,1965-04-25,F,CASERIO SANTA FE,fiebre,,Socota
72077725,Luis Héctor López Pérez,1986-08-08,M,CALLE. LOS JASMINES NRO. PUERTA SN PISO. 1,,,Socota
54927989,Sandra Diego Gutiérrez Rojas,1986-05-13,M,SANJOSE DE LIRIO,"dolor abdominal, acidez estomacal",Gastritis,Socota
93710127,Ana Eduardo Rojas Gutiérrez,1968-01-03,M,CUCHEA,,,Socota
99375830,Carmen David Delgado Mendoza,1984-11-14,M,EL CUMBE,"fiebre, pérdida de olfato",COVID-19,Socota
21553219,Sandra Mónica Herrera Delgado,1989-11-10,M,JR. SAENS PEÑA NRO. PUERTA SN PISO.01,"sed excesiva, cansancio, micción frecuente",Diabetes,Socota
22308601,Yolanda Luisa Sánchez Castillo,1999-10-03,F,CASERIO SAN ISIDRO,"sed excesiva, cansancio, micción frecuente",Diabetes,Socota
39132121,Carlos Marco Cruz Flores,1982-02-28,F,CASERIO BATANCILLO,"tos seca, pérdida de olfato, fiebre",COVID-19,Socota
17861361,Sandra Alberto Herrera López,2013-09-01,M,SAN ISIDRO,"ojos llorosos, picazón",Alergia,Socota
66151959,Verónica Isabel Gutiérrez Pérez,2023-03-13,M,SAN JOSE,"náuseas, dolor de cabeza, sensibilidad a la luz",Migraña,Socota
28319275,Sandra Natalia Delgado Ramírez,2003-01-27,M,OTRO. SERCA LA CAMINO GRANDE NRO. PUERTA SN PISO.01,"dificultad para respirar, opresión en el pecho, sibilancias",Asma,Socota
91673328,Juan Alberto Cruz Pérez,2016-10-10,M,OTRO. FILADELFIA NRO. PUERTA SN PISO.02,"congestión nasal, fiebre",Hipertensión,Socota
30046271,Juan Isabel García Flores,2008-12-10,F,CASERIO SAN JUAN DE CHORRILLOS,"dificultad para respirar, tos seca, pérdida de olfato",COVID-19,Socota
21821781,Jorge Marco Cruz Pérez,2004-04-20,M,OTRO. SAN ISIDRO NRO. PUERTA SN PISO.02,"dificultad para respirar, pérdida de olfato",COVID-19,Socota
50150031,Sandra Laura Delgado Vargas,1949-01-04,F,,"tos, congestión nasal, dolor de garganta",Gripe,Socota
68439567,Juan David Martínez Torres,2013-03-02,M,LA PACCHA,"dolor abdominal, acidez estomacal",Gastritis,Socota
33327204,Juan Eduardo Paredes Sánchez,2021-01-05,M,CENTRO POBLADO CUMBE,"opresión en el pecho, sibilancias",Asma,Socota
37279336,Miguel Diego López Martínez,2005-11-18,F,El porvenir,"tos, dolor de garganta",Gripe,Socota
97678221,María David Gutiérrez Silva,1986-02-19,M,CASERIO GRAMALOTILLO,"dolor de cabeza, visión borrosa",Hipertensión,Socota
43595776,Verónica David Rodríguez Flores,2009-11-04,F,LA PACCHA MIRAFLORES,,,Socota
54047161,José Natalia Herrera Ramírez,2013-04-29,M,CAS SAN AGUSTIN,"dolor de cabeza, mareos",Hipertensión,Socota
56695787,Ángel Sara Ramírez Delgado,2024-02-02,F,CALLAYUC,,Alergia,Socota
44184268,Lucía Olga Sánchez Martínez,2000-06-24,M,CALLE. COMERCIO NRO. PUERTA SN PISO.02,"cansancio, sed excesiva",Diabetes,Socota
20717799,Ángel Laura Torres Rodríguez,2012-02-19,M,SAN JOSE DE LIRIO,"pérdida de olfato, dificultad para respirar, fiebre",COVID-19,Socota
35589703,Rosa Pablo Mendoza Silva,1968-11-01,M,CARR. FERNANDO BELAUNDE TERRY NRO.SN BLOQUE. PISO.01 INTERIOR.  MZA.  LOTE.,"pérdida de olfato, dificultad para respirar, fiebre",COVID-19,Socota
54925215,Patricia Eduardo Delgado Vargas,1990-03-28,M,OTRO. PAMPA GRANDE NRO. PUERTA SN PISO.01,"visión borrosa, mareos",Hipertensión,Socota
14597713,Marta Andrés Torres Gutiérrez,1980-10-09,M,OTRO SAN ISIDRO NRO.SN BLOQUE. PISO.01 INTERIOR.  MZA.  LOTE.,"náuseas, sensibilidad a la luz, dolor de cabeza",Migraña,Socota
86358480,Miguel Laura González Silva,1982-10-11,M,OTRO. MATARA NRO. PUERTA SN PISO.01,náuseas,Gastritis,Socota
69008977,José Luisa González Herrera,2000-10-18,F,CASERIO UNION SAN JOSE,"sensibilidad a la luz, dolor de cabeza, náuseas",Migraña,Socota
85907600,Jesús Sara Mendoza Gutiérrez,2005-03-11,F,CP EL CUMBE,"acidez estomacal, náuseas",Gastritis,Socota
99150301,Lucía Andrés Pérez Torres,1954-01-13,F,COMERCIO SN,tos,,Socota
68949042,Ángel Luisa Pérez Torres,2015-05-22,F,OTRO. SN NRO. PUERTA SN PISO.01,,,Socota
39818579,Pedro Olga Delgado Torres,1999-10-25,M,OTRO. COSTADO INSTITUCION EDUCA NRO. PUERTA SN PISO.01,,,Socota
56652709,Lucía Natalia Gutiérrez Delgado,2015-09-25,F,OTRO. SAN ISIDRO NRO. PUERTA SN PISO.01,"dolor abdominal, acidez estomacal",Gastritis,Socota
83073707,Yolanda Cruz Pérez,2007-03-18,M,OTRO. SAN JUAN DE CHIPLE NRO. PUERTA SN PISO.01,"dificultad para respirar, tos seca",COVID-19,Socota
94191224,Patricia Natalia Gutiérrez Ramírez,1959-06-06,M,CUCHEA NOGAL,"acidez estomacal, náuseas",Migraña,Socota
72191931,Marta Marco Paredes Castillo,2024-05-24,M,CALLE COMERCIO S/N,,,Socota
22778681,Pedro Marco González Herrera,1988-11-10,F,OTRO CAMINα A YUBE SN   PISO 01,"dolor de garganta, fiebre, tos",Gripe,Socota
94050819,Carmen Luisa Rojas Herrera,1981-07-22,F,OTRO. CHORRILLOS NRO. PUERTA SN PISO.02,náuseas,COVID-19,Socota
69032572,Fernando Roberto Gutiérrez Pérez,1992-09-22,M,CALLE SAN ESPAÑA S/N,"mareos, visión borrosa, dolor de cabeza",Hipertensión,Socota
19795303,Ángel Natalia Torres Paredes,1997-10-20,M,OTRO. COSTADO BEBEDERO EL GUAYA NRO. PUERTA SN PISO.01,"dolor de cabeza, náuseas",Migraña,Socota
16839201,Luis Sara Flores Sánchez,1997-10-22,M,CASERIO CHURAZ,"dificultad para respirar, opresión en el pecho",Asma,Socota
39917092,Yolanda Héctor González García,1974-02-28,F,CASERIO SAN JOSE FLOR DE LIRIO,"tos seca, pérdida de olfato",COVID-19,Socota
40736856,Fernando Luisa Vargas Mendoza,2004-10-02,M,SAN JUAN DE CHORRILLOS,"acidez estomacal, dolor abdominal",Gastritis,Socota
15868266,Marta Roberto Herrera Rojas,2004-04-29,M,SAN JUAN BAUTISTA,"mareos, visión borrosa",Hipertensión,Socota
10131747,Fernando Isabel Vargas Ramírez,1988-12-15,M,OTRO. COSTADO CASA COMUNAL NRO. PUERTA SN PISO.01,"dolor de cabeza, visión borrosa, mareos",Hipertensión,Socota
17704604,Lucía Olga Ramírez Silva,2011-08-27,F,CASERIO SALLOC,"ojos llorosos, picazón",COVID-19,Socota
31376643,Carlos Martínez Vargas,2014-06-22,M,VISTA ALEGRE,"sensibilidad a la luz, náuseas, dolor de cabeza",Migraña,Socota
37811470,Marta Diego Vargas Gutiérrez,1990-03-28,M,OTRO. PAMPA GRANDE NRO. PUERTA SN PISO.01,"visión borrosa, mareos",Hipertensión,Socota
45573924,José Eduardo Torres Gutiérrez,2008-07-11,M,SAN JUAN BAUTISTA,"náuseas, acidez estomacal, dolor abdominal",Gastritis,Socota
42052745,José Claudia Sánchez Vargas,2001-03-31,M,CHONTAS ALTAS,"visión borrosa, mareos",Hipertensión,Socota
53759940,Fernando Raúl Silva Delgado,2015-05-21,M,SAN JOSE DE LIRIO,"náuseas, sensibilidad a la luz",Migraña,Socota
35017299,Patricia Carolina Vargas Flores,2003-06-18,M,CASERIO BATANCILLOS,"dificultad para respirar, sibilancias",Alergia,Socota
99812580,Yolanda David Paredes Gutiérrez,2016-11-17,M,OTRO. CAMINO A CHURAZ NRO. PUERTA SN PISO.01,"sed excesiva, cansancio, micción frecuente",Diabetes,Socota
11959304,Rosa Gloria Vargas Silva,1975-02-24,M,CALLAYUC,dificultad para respirar,Gripe,Socota
33464457,Verónica Pablo Flores Cruz,1961-08-11,F,CASERIO CHURAZ,dolor de garganta,Asma,Socota
15876748,Pedro Pablo García Ramírez,2021-05-29,F,CENTRO POBLADO CUMBE,"opresión en el pecho, dificultad para respirar",Asma,Socota
77123730,Carlos Andrés García Rojas,1989-05-01,F,OTRO. SAN JOSE DE LIRIO NRO. PUERTA SN PISO.01,,,Socota
19091263,Lucía Alberto Vargas Herrera,1965-08-03,F,PUQUIO,"congestión nasal, fiebre",Gripe,Socota
98489465,Sandra Olga Gutiérrez Herrera,1993-02-01,F,VILUCO,"náuseas, dolor de cabeza, sensibilidad a la luz",Migraña,Socota
87949729,Verónica Eduardo González Flores,1992-12-29,M,OTRO VILUCO NRO.SN BLOQUE. PISO.01 INTERIOR.  MZA.  LOTE.,náuseas,Asma,Socota
21209608,Juan Laura Cruz Rodríguez,1980-02-06,M,,"sibilancias, opresión en el pecho",Asma,Socota
58796931,Marta Gloria García Rojas,2002-03-12,F,CASERIO BATANCILLO,"náuseas, dolor abdominal",Gastritis,Socota
43189491,Ana Eduardo Rojas Martínez,1985-06-19,F,CP SAN JOSE DE LIRIO,"sensibilidad a la luz, náuseas",Migraña,Socota
24471770,Jorge Isabel García Cruz,2008-08-08,F,LA PACCHA MIRAFLORES,dolor de cabeza,Asma,Socota
99508944,Yolanda Isabel Sánchez Martínez,1982-05-25,M,CASERIO GRAMALOTILLO,"acidez estomacal, náuseas, dolor abdominal",Gastritis,Socota
67229214,Ángel Laura Gutiérrez Silva,1950-11-04,M,BATANCILLO,"dolor abdominal, acidez estomacal, náuseas",Gastritis,Socota
19566187,Carmen Laura Cruz López,2010-10-29,F,CASERIO SANTA RITA,"sensibilidad a la luz, náuseas",Migraña,Socota
84774609,Sandra Claudia Mendoza Gutiérrez,2001-09-06,M,EL CUMBE,"opresión en el pecho, dificultad para respirar",Asma,Socota
86260328,Verónica Laura Silva Flores,1942-04-07,F,SANTA RITA,"fiebre, tos seca, pérdida de olfato",COVID-19,Socota
27112019,Patricia Claudia Rojas Pérez,2006-10-25,F,SAN JUAN,"dolor de garganta, congestión nasal, fiebre",Gripe,Socota
61171705,Pedro Olga Delgado Torres,1962-06-19,F,EL CUMBE,"dolor de cabeza, náuseas, sensibilidad a la luz",Migraña,Socota
91679816,Jesús Natalia López Mendoza,1975-08-14,M,CRR. LA FLOR SN   PISO 01,"estornudos, ojos llorosos, picazón",Alergia,Socota
28155998,Jorge Sara Rojas Delgado,1980-02-27,M,SANTA FE,"tos, fiebre",Gripe,Socota
27401247,Luis Martínez Cruz,1975-07-26,F,EL CUMBE,"opresión en el pecho, sibilancias",Hipertensión,Socota
51672654,Marta Eduardo Gutiérrez Flores,1972-05-09,M,C.P.EL CUMBE,"estornudos, ojos llorosos, picazón",Alergia,Socota
56169248,Pedro Isabel Silva Paredes,1976-04-06,M,CASERIO SALLOF,"dolor abdominal, acidez estomacal",Gastritis,Socota
11603878,Juan Gloria Silva Mendoza,2001-07-21,M,,,,Socota
78761174,Fernando Pablo González Torres,2003-01-27,M,OTRO. SERCA LA CAMINO GRANDE NRO. PUERTA SN PISO.01,"dificultad para respirar, opresión en el pecho, sibilancias",Asma,Socota
32411250,Luis Claudia Silva Rojas,1998-04-12,M,SAN ISIDRO,,,Socota
41828616,Yolanda Natalia Sánchez González,2018-04-20,M,OTRO. CALLAYUC NRO. PUERTA SN PISO.01,"náuseas, acidez estomacal",Alergia,Socota
52902401,Carmen Gloria Mendoza Flores,2017-12-23,M,OTRO. LA LIBERTAD NRO. PUERTA SN PISO.01,"náuseas, dolor de cabeza",Migraña,Socota
52772825,Jorge Roberto González Delgado,2011-09-21,F,CASERIO PUQUIO,"dificultad para respirar, opresión en el pecho",Diabetes,Socota
69288411,Ángel Marco Herrera Rojas,2012-10-21,M,SAN JOSE DE LIRIO,"dificultad para respirar, fiebre",COVID-19,Socota
52584914,Carlos Olga González Paredes,2005-10-28,M,CASERIO GRAMALOTILLO,"mareos, dolor de cabeza",Hipertensión,Socota
92352708,Verónica Diego García Delgado,1985-11-01,M,PINDOC,"tos, fiebre, congestión nasal",Gripe,Socota
49251634,María Isabel Sánchez Herrera,2016-01-25,M,EL CUMBE,"fiebre, dolor de garganta, congestión nasal",Gripe,Socota
94680435,Juan Sánchez Pérez,2003-01-10,M,EL CUMBE,"sed excesiva, micción frecuente",Diabetes,Socota
31519639,Jesús Andrés Paredes Herrera,1969-12-14,F,C.P.EL CUMBE,acidez estomacal,COVID-19,Socota
98707825,Jesús Raúl Castillo Sánchez,1966-06-27,F,C.P.EL CUMBE,"fiebre, congestión nasal, dolor de garganta",Gripe,Socota
63393591,Carlos Alberto Castillo Vargas,1997-03-15,M,OTRO. NUEVO MORERO NRO. PUERTA SN PISO.01,"mareos, dolor de cabeza",Gripe,Socota
94916832,Pedro Héctor Cruz Flores,1961-05-26,M,VISTA ALEGRE,,Gastritis,Socota
93484516,Jesús Luisa Martínez Paredes,1965-04-16,M,CASERIO CUCHEA,"dificultad para respirar, sibilancias",Asma,Socota
94525391,Sandra Gloria Paredes Pérez,1948-08-24,F,OTRO CASERIO HUERTILLAS NRO.SN BLOQUE. PISO.01 INTERIOR.  MZA.  LOTE.,"dificultad para respirar, pérdida de olfato, tos seca",COVID-19,Socota
83412942,Pedro Luisa Herrera Paredes,2000-02-18,M,EL CUMBE,"dificultad para respirar, sibilancias, opresión en el pecho",Asma,Socota
22322160,Fernando Sara Martínez Sánchez,1988-10-09,F,CASERIO YAPANA,"picazón, estornudos",Alergia,Socota
27741646,Sandra García Herrera,2008-10-14,F,EL CUMBE,estornudos,Hipertensión,Socota
97154216,Rosa Isabel Pérez Paredes,1994-01-10,M,CRR. A CUTERVO SN   PISO 01,,,Socota
36177753,Jorge Marco Torres Vargas,1964-08-20,F,C.P.EL CUMBE,,Diabetes,Socota
94957072,Carmen Raúl Paredes Mendoza,2017-09-03,F,OTRO. CUMBE NRO. PUERTA SN PISO.01,"mareos, dolor de cabeza, visión borrosa",Hipertensión,Socota
68837460,Ana Isabel Ramírez Silva,1976-07-19,F,CASERIO CHONTAS ALTAS,,,Socota
30728587,Lucía Claudia Vargas Pérez,1981-10-20,F,SAN ISIDRO,"dificultad para respirar, fiebre",COVID-19,Socota
81793165,Miguel Andrés Vargas Martínez,2012-07-07,M,CALLAYUC,"dolor de cabeza, mareos",Hipertensión,Socota
76106792,Carmen Claudia Rodríguez Ramírez,1998-07-15,M,CHURAZ,"tos, fiebre",Gripe,Socota
10319675,Sandra Eduardo García Cruz,1994-05-19,M,OTRO. QUEROMARCA NRO. PUERTA SN PISO.01,"dolor de garganta, congestión nasal, fiebre",Gripe,Socota
92162861,Carmen Eduardo Vargas Cruz,2008-12-10,F,CASERIO SAN JUAN DE CHORRILLOS,"dificultad para respirar, tos seca, pérdida de olfato",COVID-19,Socota
47110525,Verónica Sara Herrera Martínez,2022-04-11,F,cas. chontas,picazón,Asma,Socota
98133856,Pedro Luisa Delgado Paredes,2019-04-01,F,OTRO A 20 MINUTOS DEL CASERIO NRO.SN BLOQUE. PISO.02 INTERIOR.  MZA.  LOTE. km.,,,Socota
30550599,Pedro Luisa Pérez Herrera,1996-03-10,F,OTRO SAN JUAN  DE CHORRILOS NRO.SN BLOQUE. PISO.01 INTERIOR.  MZA.  LOTE.,,,Socota
57482006,Carmen Claudia Rodríguez López,1986-10-21,F,CALLAYUC,"picazón, estornudos, ojos llorosos",Alergia,Socota
17493293,Lucía Héctor Flores Silva,2022-12-09,M,CASERIO VISTA ALEGRE,,Migraña,Socota
22892646,María Sara García Delgado,1970-02-28,M,CASERIO SAN JUAN DE CHORRILLOS,"pérdida de olfato, tos seca, fiebre",COVID-19,Socota
73916264,Marta Delgado Torres,1963-01-21,M,CALLAYUC,"visión borrosa, mareos",Diabetes,Socota
84970046,Fernando Andrés Silva Flores,1962-04-15,F,UNION SAN JOSE,"dolor abdominal, náuseas, acidez estomacal",Gastritis,Socota
48064810,Luis Pablo Rojas Paredes,2008-03-31,F,SAN JUAN BAUTISTA,"sensibilidad a la luz, dolor de cabeza, náuseas",Migraña,Socota
76307266,Miguel David Ramírez Mendoza,1967-11-25,M,CASERIO SAN JUAN,"tos, congestión nasal, dolor de garganta",Gripe,Socota
48984453,Carlos Olga Cruz Silva,1962-06-07,F,SAN JUAN BAUTISTA,"cansancio, micción frecuente, sed excesiva",Diabetes,Socota
83511035,Ángel Olga Rojas Paredes,1949-04-12,M,,,,Socota
33583918,José Natalia Silva Torres,2007-04-08,M,CASERIO SAN JOSE DE LIRIO,,Alergia,Socota
18654034,Lucía Claudia Delgado Cruz,2007-01-01,M,CASERIO CHURAZ,,,Socota
72003723,Juan Marco Ramírez Pérez,2002-11-23,F,OTRO. LA PACCHA MIRAFLORES NRO. PUERTA SN PISO.01,"cansancio, micción frecuente",Alergia,Socota
65160895,Marta Eduardo Mendoza Silva,1971-08-06,M,SAN ISIDRO,"dolor de cabeza, sensibilidad a la luz",Migraña,Socota
68352367,Patricia Carolina Herrera Gutiérrez,1992-04-07,F,OTRO. CASERIO LIMON NRO. PUERTA SN PISO.01,"dificultad para respirar, fiebre",COVID-19,Socota
67267330,Ana Eduardo Silva Herrera,2005-05-24,F,CP.EL CUMBE,"dificultad para respirar, opresión en el pecho",Asma,Socota
45484477,Lucía Roberto Delgado García,1998-07-15,M,CHURAZ,"tos, fiebre",Gripe,Socota
67128665,Sandra Marco García Castillo,2017-02-13,M,OTRO. HUERTILLAS NRO. PUERTA SN PISO.01,"náuseas, dolor abdominal, acidez estomacal",Gastritis,Socota
56863684,Rosa Carolina Ramírez Torres,1984-11-14,M,EL CUMBE,"fiebre, pérdida de olfato",COVID-19,Socota
94310707,Yolanda Gloria Rojas Cruz,2003-08-05,M,GRAMALOTILLO,"fiebre, pérdida de olfato, tos seca",COVID-19,Socota
82965509,Ana Claudia Pérez Rodríguez,2001-10-25,M,EL CUMBE,"dolor abdominal, náuseas",Gastritis,Socota
77488269,Jorge Carolina Delgado Flores,2016-08-25,M,EL CUMBE,"mareos, dolor de cabeza",Diabetes,Socota
35501414,Juan Héctor Silva Cruz,2004-07-14,F,EL PUQUIO,"náuseas, sensibilidad a la luz, dolor de cabeza",Migraña,Socota
48970199,Miguel Sara Herrera García,1974-02-28,F,CASERIO SAN JOSE FLOR DE LIRIO,"tos seca, pérdida de olfato",COVID-19,Socota
62620953,Patricia Isabel García Herrera,1976-09-06,M,CHURAZ,"ojos llorosos, estornudos",Alergia,Socota
46341388,Verónica Mónica Silva Paredes,2016-01-13,M,CP EL CUMBE,tos,,Socota
72983056,Rosa Olga González Rojas,2022-02-13,M,CHURAZ,"visión borrosa, mareos, dolor de cabeza",Hipertensión,Socota
15436971,Ana Natalia Torres Delgado,1988-03-27,M,,"pérdida de olfato, tos seca",COVID-19,Socota
66620422,Jorge Héctor González Sánchez,2018-05-06,M,OTRO. PACCHA MIRAFLORES NRO. PUERTA SN PISO.01,congestión nasal,COVID-19,Socota
31182863,Juan Isabel Gutiérrez González,1968-06-15,F,SAN ISIDRO,"mareos, dolor de cabeza",Asma,Socota
56345803,Carlos Natalia Flores López,2002-11-15,M,CASERIO SANTA RITA,estornudos,Hipertensión,Socota
42740287,Luis David Paredes Sánchez,1963-02-23,M,OTRO. CHURAZ NRO. PUERTA SN PISO.01,pérdida de olfato,Diabetes,Socota
42630252,José Luisa Flores Rodríguez,1977-08-12,M,SAN JOSE DE LIRIO,"picazón, estornudos, ojos llorosos",Alergia,Socota
28670761,Ángel Laura Ramírez García,2001-08-01,M,CASERIO PUQUIO,"dificultad para respirar, fiebre, pérdida de olfato",COVID-19,Socota
10186851,Sandra Diego García Delgado,2009-02-12,F,VISTA ALEGRE,"sibilancias, opresión en el pecho",Asma,Socota
54992388,Fernando Diego Vargas López,1960-09-16,F,OTRO SECTOR LIMA PAMPA SN   PISO 01,,Asma,Socota
35715532,Rosa Andrés Flores Vargas,1987-07-11,M,CALLAYUC,,,Socota
94366230,Miguel Diego Ramírez González,2011-05-12,F,BATANCILLO,dolor de cabeza,,Socota
35521284,Jesús Gloria Delgado Cruz,1953-12-12,M,,visión borrosa,Gastritis,Socota
44484755,Lucía Isabel Rojas Cruz,1990-02-27,F,SAN JOSE DE LIRIO,"micción frecuente, cansancio",Diabetes,Socota
18732092,Miguel Carolina Silva Vargas,1997-04-13,M,OTRO. SECTOR ILLIRON NRO. PUERTA SN PISO.01,"sed excesiva, micción frecuente, cansancio",Diabetes,Socota
84708571,Fernando Roberto Gutiérrez Castillo,1978-06-23,F,CASERIO FILA ALTA,"dolor abdominal, náuseas, acidez estomacal",Gastritis,Socota
50715943,Yolanda Mónica Pérez García,2011-02-19,F,EL CUMBE,"opresión en el pecho, sibilancias, dificultad para respirar",Asma,Socota
59066237,Patricia Eduardo Silva Mendoza,1993-09-21,M,OTRO. CAMINO A SAN JOSE DE LIRI NRO. PUERTA SN PISO.01,"tos, dolor de garganta",Gripe,Socota
24006975,Marta Pablo Silva Herrera,1990-08-15,F,EL CUMBE,"ojos llorosos, picazón",Alergia,Socota
33721217,Carmen Cruz García,2009-03-30,M,EL CUMBE,,,Socota
55795729,María Pablo Delgado Paredes,2010-05-06,F,CUCHEA,"fiebre, pérdida de olfato",COVID-19,Socota
87628877,Jorge Laura Flores Castillo,1989-07-06,F,EL CUMBE,"dolor de cabeza, mareos, visión borrosa",Hipertensión,Socota
36503036,Ángel Héctor Flores Torres,2002-04-24,M,CASERIO SAN JOSE DE LIRIO,"náuseas, acidez estomacal",Gastritis,Socota
40341968,Sandra Diego Herrera Sánchez,2010-06-29,F,distrito de callayuc,"tos, dolor de garganta, fiebre",Gripe,Socota
75905268,Miguel Gloria Rojas Paredes,1994-02-20,F,OTRO. SALLOF NRO. PUERTA SN PISO.01,"congestión nasal, tos",Gripe,Socota
94641433,Pedro Claudia Paredes Rodríguez,2015-05-15,F,NOGAL,"sensibilidad a la luz, dolor de cabeza, náuseas",Migraña,Socota
57251234,Fernando Andrés Vargas Castillo,2019-08-01,M,OTRO. CHURAZ NRO. PUERTA SN PISO.01,,,Socota
81111194,Verónica Gloria Torres Rodríguez,1997-06-18,M,EL SALLOC,"náuseas, acidez estomacal",Gastritis,Socota
53267480,José Mónica Herrera Delgado,2001-03-05,M,COMUNIDAD EL CUMBE,"picazón, ojos llorosos",Alergia,Socota
55903075,Marta Carolina Flores Torres,1985-09-18,F,CASERIO VILUCO,sensibilidad a la luz,COVID-19,Socota
12144995,Patricia Alberto Rodríguez Gutiérrez,1989-02-10,F,CASERIO CUCHEA,"náuseas, dolor abdominal",Gripe,Socota
60427528,Marta Diego Flores Delgado,2023-03-01,M,CUMBE,"dolor de cabeza, visión borrosa, mareos",Hipertensión,Socota
91810107,Juan Andrés López González,2016-09-09,M,OTRO. CALLAYUC NRO. PUERTA SN PISO.01,"náuseas, sensibilidad a la luz, dolor de cabeza",Migraña,Socota
56064915,José Laura Rojas Flores,1974-12-28,F,CP.EL CUMBE,"picazón, ojos llorosos",Alergia,Socota
93439353,Ana David López Pérez,1972-04-10,F,SANTA TERESA DE QUEROMARCA,"dolor de cabeza, mareos, visión borrosa",Hipertensión,Socota
57031708,Marta David Pérez Flores,2006-06-30,M,CALLE JAEN S/N,dolor de cabeza,Gripe,Socota
25911527,Ángel David Castillo Rodríguez,1996-01-06,M,SANTA TERESA DE QUEROMARCA,"cansancio, sed excesiva",Alergia,Socota
44958749,Carmen Olga Herrera Paredes,1997-05-31,F,YAPANA,"dolor de cabeza, sensibilidad a la luz, náuseas",Migraña,Socota
47255393,Rosa Alberto Vargas Mendoza,1999-04-27,F,OTRO. CAMINO AL CUMBE NRO. PUERTA SN PISO.01,"tos seca, pérdida de olfato",COVID-19,Socota
83852831,Ana Héctor Torres Sánchez,2001-09-24,M,CASERIO EL CUMBE,,,Socota
48961347,Ángel Claudia Paredes Martínez,1960-01-24,M,CASERIO SANTA RITA,"ojos llorosos, estornudos, picazón",Alergia,Socota
60702348,Pedro Eduardo Mendoza Delgado,2018-09-14,F,OTRO. CUMBE NRO. PUERTA SN PISO.02,"opresión en el pecho, dificultad para respirar",Asma,Socota
14500737,Verónica Héctor Ramírez Castillo,1964-04-21,F,CALLAYUC,,Gastritis,Socota
40807813,José Héctor Silva Flores,1966-07-02,F,OTRO CAMINO A VILUCO SN   PISO 01,"sibilancias, dificultad para respirar, opresión en el pecho",Asma,Socota
14266375,Miguel Roberto Castillo Sánchez,2020-06-21,F,,"dificultad para respirar, opresión en el pecho, sibilancias",Asma,Socota
34570286,Ana Eduardo López Gutiérrez,1994-04-24,F,,"fiebre, tos, congestión nasal",Gripe,Socota
37860811,José Héctor Silva López,2003-05-14,M,CALLAYUC,"opresión en el pecho, sibilancias, dificultad para respirar",Asma,Socota
19923026,Miguel Luisa Sánchez Martínez,1967-07-29,F,SAN JUAN DE CHORRILLOS,"náuseas, dolor abdominal",Gastritis,Socota
96070583,Miguel Andrés Gutiérrez Pérez,2018-12-17,F,OTRO. BATANCILLO NRO. PUERTA SN PISO.02,,,Socota
11542647,Jesús Andrés Rojas Mendoza,1987-10-01,M,CASERIO MERENDANA,"sed excesiva, micción frecuente",Diabetes,Socota
83848123,Jorge Héctor Vargas Mendoza,1999-09-27,M,OTRO. CALLAYUC NRO. PUERTA SN PISO.01,"náuseas, dolor abdominal, acidez estomacal",Gastritis,Socota
95609062,Juan Natalia Sánchez González,1992-06-10,M,CASERIO BATANCILLO,"sibilancias, dificultad para respirar",Asma,Socota
33946308,Sandra Alberto Vargas Herrera,2016-08-21,F,OTRO. SAN JUAN DE CHIPLE NRO. PUERTA SN PISO.02,"dolor de cabeza, náuseas, sensibilidad a la luz",Migraña,Socota
22375453,Verónica Diego Flores Rodríguez,1992-02-12,M,OTRO. CUMBE NRO. PUERTA SN PISO.01,"dolor abdominal, acidez estomacal, náuseas",Gastritis,Socota
24124335,Patricia Natalia Martínez Rodríguez,2000-06-16,F,YAPANA,"visión borrosa, mareos",Hipertensión,Socota
11743812,Lucía Olga García Herrera,2023-02-10,M,CALLAYUC,"dolor de cabeza, visión borrosa",COVID-19,Socota
91203575,José Laura Rodríguez Delgado,1977-08-02,M,SAN JOSE DE LIRIO,"dolor abdominal, acidez estomacal",Migraña,Socota
80008656,Patricia Héctor Herrera Gutiérrez,1976-03-14,F,EL CUMBE,"sibilancias, opresión en el pecho, dificultad para respirar",Asma,Socota
82206269,Carmen Laura González Martínez,2023-01-23,M,CASERIO SAN JOSE,"micción frecuente, sed excesiva",Diabetes,Socota
