DNI,Asegurado,FecNac,SEXO,CPP,síntomas,enfermedad detectada,Distrito
41457334,José Alberto Torres Pérez,2020-09-01,F,CASERIO YAPANA,"náuseas, acidez estomacal, dolor abdominal",Gastritis,Socota
44522009,Pedro Diego Flores Cruz,1989-04-19,F,AV COMERCIO SN,"dolor abdominal, náuseas, acidez estomacal",Gastritis,Socota
53432382,Jesús Eduardo Martínez Cruz,1972-05-09,M,C.P.EL CUMBE,"estornudos, ojos llorosos, picazón",Alergia,Socota
23608658,Luis Carolina Castillo Vargas,2004-10-12,M,CHURAZ,"tos, dolor de garganta, congestión nasal",Gripe,Socota
18831530,Fernando Roberto Cruz Pérez,2001-07-30,M,SAN ISIDRO,"dificultad para respirar, opresión en el pecho, sibilancias",Asma,Socota
84508491,Miguel Diego Gutiérrez Castillo,1979-01-03,F,SAN JOSE DE LIRIO,"dificultad para respirar, opresión en el pecho, sibilancias",Asma,Socota
68914250,Verónica Natalia Cruz Rojas,2021-07-12,M,CASERIO VILUCO,"sed excesiva, micción frecuente",Diabetes,Socota
57722671,Luis Claudia Castillo Mendoza,2021-09-23,M,CASERIO LA MERENDANA,"sed excesiva, cansancio",Diabetes,Socota
50889935,Luis Luisa Delgado García,2007-05-09,M,PAMPA GRANDE,"visión borrosa, mareos",Hipertensión,Socota
56804758,Marta Luisa Delgado Castillo,2002-06-24,F,OTRO SAN JUAN DE CHORRILLOS NRO.SN BLOQUE. PISO.1 INTERIOR.  MZA.  LOTE. KM.,,,Socota
89840740,Fernando Silva Paredes,2008-06-01,M,SAN JOSE DE LIRIO,"dificultad para respirar, sibilancias, opresión en el pecho",Asma,Socota
31523192,Carlos Isabel Silva Rodríguez,2003-04-18,F,CASERIO LAGUNAS,"fiebre, dolor de garganta",Gripe,Socota
53614757,Yolanda Pérez Herrera,2003-11-23,M,EL CUMBE,"náuseas, sensibilidad a la luz, dolor de cabeza",Migraña,Socota
34801487,Ángel Laura García Pérez,2006-08-21,M,SAN ANTONIO DE VILUCO,,,Socota
35283641,Miguel Natalia Delgado Gutiérrez,2017-08-10,F,OTRO. SAN JUAN BAUTISTA NRO. PUERTA SN PISO.01,"picazón, estornudos, ojos llorosos",Alergia,Socota
87157490,Rosa Pablo Herrera Silva,1983-07-29,M,,,,Socota
43632245,Miguel Olga Ramírez Cruz,2024-05-10,M,SAN JUN BAUTISTA,"micción frecuente, cansancio",Diabetes,Socota
28942832,Rosa Marco Mendoza Delgado,2019-08-31,M,OTRO. HUALAMILIO NRO. PUERTA SN PISO.01,"cansancio, sed excesiva, micción frecuente",Diabetes,Socota
43482734,Carmen Mónica García Torres,1994-12-02,F,,"sibilancias, dificultad para respirar",Asma,Socota
74292914,Sandra Eduardo Flores García,1974-12-28,F,CP.EL CUMBE,"picazón, ojos llorosos",Alergia,Socota
16757795,Miguel Marco Rojas Torres,2021-02-15,M,CASERIO VIZCACHA,"sensibilidad a la luz, dolor de cabeza",Migraña,Socota
24681752,Verónica Mónica Rojas Rodríguez,1989-10-27,M,JR. COMERCIO NRO. PUERTA SN PISO.01,"ojos llorosos, picazón",Alergia,Socota
99892943,Carmen Carolina Vargas Silva,2002-05-11,F,,fiebre,Hipertensión,Socota
12612747,Carmen Diego Torres Rojas,2008-03-10,M,chorrillos,"picazón, estornudos",Alergia,Socota
50066218,Marta Laura González Silva,1998-07-14,F,VILUCO,"sed excesiva, micción frecuente",Diabetes,Socota
36958351,María Pablo López Sánchez,1983-09-25,M,CASERIO SANTA FE,"picazón, estornudos",Alergia,Socota
68733272,Jorge Natalia Ramírez Delgado,2014-02-14,F,CASERIOCUCHEA,,,Socota
54277676,Carlos Sara Gutiérrez Pérez,1972-09-24,F,CALLAYUC,"visión borrosa, mareos",Hipertensión,Socota
69468366,Fernando Marco Torres Paredes,2002-11-23,F,OTRO. LA PACCHA MIRAFLORES NRO. PUERTA SN PISO.01,"cansancio, micción frecuente",Alergia,Socota
17568350,Miguel Gloria Herrera Torres,1993-09-03,M,OTRO VISTA ALEGRE NRO.SN BLOQUE. PISO.01 INTERIOR.  MZA.  LOTE.,"mareos, dolor de cabeza",Hipertensión,Socota
69987090,Yolanda Natalia Paredes Torres,1965-04-27,M,CABRAMAYO,,Gripe,Socota
13281374,José Mónica Torres Gutiérrez,1935-05-15,F,EL CUMBE,"cansancio, micción frecuente, sed excesiva",Diabetes,Socota
16965596,Lucía Vargas Cruz,1952-06-26,M,OTRO. CUCHEA NOGAL NRO. PUERTA SN PISO.01,"ojos llorosos, estornudos, picazón",Alergia,Socota
18126405,Ana Gloria Flores Herrera,1964-12-26,M,OTRO. LA PACCHA MIRAFLORES NRO. PUERTA SN PISO.01,"dolor de cabeza, visión borrosa",Hipertensión,Socota
54957296,Ángel Gloria Cruz Delgado,2021-08-24,M,SECTOR EL CAMPO,"sibilancias, opresión en el pecho, dificultad para respirar",Asma,Socota
47530690,María Carolina Herrera López,1995-06-19,M,CALLAYUC,"sed excesiva, cansancio",Diabetes,Socota
83956999,Sandra Héctor Torres González,1966-01-16,F,BATANCILLO,cansancio,Migraña,Socota
86541325,Marta Luisa Rodríguez Vargas,1957-10-01,M,,dolor de garganta,COVID-19,Socota
19277983,Ana Alberto Flores Castillo,1982-07-03,F,CALLAYUC,fiebre,,Socota
77941955,Rosa Alberto Vargas Rodríguez,1994-07-15,F,,,Gripe,Socota
57823533,Rosa Flores García,1964-04-30,M,OTRO HUABAL NRO.SN BLOQUE. PISO.01 INTERIOR.  MZA.  LOTE.,"dolor de garganta, fiebre",Hipertensión,Socota
90548582,Jesús David Delgado Paredes,2000-05-25,M,,"tos seca, pérdida de olfato",COVID-19,Socota
78300259,Ángel Eduardo Flores Castillo,1995-01-01,F,OTRO SANTA RITA NRO.SN BLOQUE. PISO.01 INTERIOR.  MZA.  LOTE. km.,"tos, congestión nasal",Gripe,Socota
76532884,Juan Laura Silva Rojas,2019-12-25,F,YAPANA,tos,,Socota
30528816,Yolanda Alberto González Gutiérrez,2001-10-20,F,CALLE. CALLE TUPAC AMARU S/N NRO. PUERTA SN PISO.01,"náuseas, dolor abdominal",Gastritis,Socota
90183687,Verónica Marco Delgado Rodríguez,2021-12-11,M,CHURAZ,cansancio,Asma,Socota
76309497,Jesús Luisa Rodríguez Rojas,1975-05-17,M,LA UNION,"sed excesiva, cansancio",Diabetes,Socota
57693746,Luis Andrés González Flores,1967-01-05,F,OTRO OTRO NRO.SN BLOQUE. PISO.01 INTERIOR.  MZA.  LOTE.,"dolor de cabeza, sensibilidad a la luz",Migraña,Socota
62683871,Juan Andrés Flores Sánchez,1970-10-29,F,CARR. BATANCILLO NRO.SN BLOQUE. PISO.02 INTERIOR.  MZA.  LOTE.,"picazón, estornudos",Hipertensión,Socota
46699651,Ana Gloria Rojas García,2011-10-13,F,SAN JOSE DE LIRIO,,,Socota
69457503,Lucía Marco Rodríguez Cruz,1989-05-18,F,CASERIO CHURAZ,"congestión nasal, tos, fiebre",Gripe,Socota
10581522,Fernando Isabel Ramírez Gutiérrez,2000-09-20,F,CASERIO SAN JUAN DE CHORRILLOS,"dolor de cabeza, náuseas",Migraña,Socota
21341371,Miguel Marco García López,1956-08-22,M,OTRO TROCHA CARROZABLE SN   PISO  1    KM   70,,Gripe,Socota
40914645,María Diego Gutiérrez Rojas,1976-06-13,M,CALLAYUC,"pérdida de olfato, fiebre",Alergia,Socota
29121617,Marta Isabel Cruz Rodríguez,1975-07-28,M,CASERIO CHURAZ,"náuseas, dolor de cabeza",Migraña,Socota
13984487,Miguel Carolina Delgado Silva,2014-12-29,F,OTRO. VISTA ALEGRE NRO. PUERTA SN PISO.01,"cansancio, micción frecuente, sed excesiva",Diabetes,Socota
24131562,Ángel Raúl Flores Castillo,1947-09-10,M,OTRO YAPANA NRO.SN BLOQUE. PISO.01 INTERIOR.  MZA.  LOTE.,"náuseas, sensibilidad a la luz, dolor de cabeza",Migraña,Socota
56755679,Sandra Eduardo Torres Cruz,1998-08-14,M,CHURAZ,dolor abdominal,COVID-19,Socota
99968450,Carlos Diego Pérez Flores,1994-11-08,M,,"dificultad para respirar, pérdida de olfato",COVID-19,Socota
62589238,Patricia Mónica Flores Vargas,2003-08-05,F,PUQUIO,,Hipertensión,Socota
61109344,Lucía Luisa López Castillo,2021-04-16,M,CASERIO CHORRILLOS,náuseas,Hipertensión,Socota
84721355,Verónica Carolina Torres Rodríguez,1966-04-20,F,OTRO. BUENOS AIRES NRO. PUERTA SN PISO.01,"dificultad para respirar, fiebre",COVID-19,Socota
27215893,Lucía Natalia Vargas Herrera,1966-02-20,M,CALLE CALLAYUC NRO.SN BLOQUE. PISO.01 INTERIOR.  MZA.  LOTE.,picazón,Hipertensión,Socota
67353606,Sandra Claudia Herrera Ramírez,1980-04-22,F,,"pérdida de olfato, dificultad para respirar, tos seca",COVID-19,Socota
29127433,Verónica Eduardo Rojas Paredes,2013-08-06,F,CAVICO,"opresión en el pecho, sibilancias",Asma,Socota
76258272,Jesús Alberto Castillo Mendoza,2014-03-17,M,CASERIO SAN JOSE DE LIRIO,"picazón, ojos llorosos, estornudos",Alergia,Socota
60453916,Verónica Héctor García López,1972-08-25,F,C.P.EL CUMBE,fiebre,Asma,Socota
15251634,Patricia Pablo Rojas Ramírez,1996-04-24,M,OTRO. COSTADO DEL CAMPO DEPORTI NRO. PUERTA SN PISO.01,"visión borrosa, dolor de cabeza",Hipertensión,Socota
64576958,María Héctor Paredes Delgado,1934-07-10,F,EL CUMBE,"congestión nasal, tos",Gripe,Socota
84379968,Juan Pablo Ramírez Paredes,1975-06-30,F,SAN ANTONIO DE VILUCO,"fiebre, dificultad para respirar",COVID-19,Socota
39974347,Lucía Roberto González Rojas,2020-01-22,M,CUCHEA,"picazón, ojos llorosos",COVID-19,Socota
92527808,Verónica Gloria Ramírez Rodríguez,2016-06-06,F,CASERIO FILA ALTA,"mareos, visión borrosa",Hipertensión,Socota
14163374,Lucía Natalia López Castillo,1994-11-15,F,OTRO. LINDERO CON SANTA TERESA NRO. PUERTA SN PISO.01,"sed excesiva, micción frecuente",Diabetes,Socota
78528599,Sandra Olga Vargas Castillo,1986-11-03,M,OTRO. BUENOS AIRES NRO. PUERTA SN PISO.01,"náuseas, acidez estomacal, dolor abdominal",Gastritis,Socota
16384760,Pedro Natalia Delgado Gutiérrez,2001-05-20,M,CASERIO LA PACCHA MIRAFLORES,"dolor de cabeza, sensibilidad a la luz",Migraña,Socota
45121536,Carmen Andrés Paredes Delgado,2021-09-05,M,VILUCO,"sed excesiva, cansancio",Diabetes,Socota
61733784,Fernando Raúl Pérez Flores,1974-11-14,M,EL CUMBE,,,Socota
17090308,Marta Marco Torres Herrera,2004-09-27,M,CALLAYUC,"dificultad para respirar, sibilancias, opresión en el pecho",Asma,Socota
56203662,Miguel Diego Ramírez Rojas,2014-07-07,M,DISTRITO DE CALLAYUC,"ojos llorosos, picazón",Alergia,Socota
18352156,Carmen Sara González Castillo,2021-08-30,M,,"sensibilidad a la luz, dolor de cabeza, náuseas",Migraña,Socota
86177495,Carmen Pablo Ramírez Rojas,1977-03-13,M,CASERIO YAPANA,"estornudos, ojos llorosos",Alergia,Socota
88910934,Marta Isabel Silva Castillo,1995-06-17,F,LAS JUNTAS,"dificultad para respirar, sibilancias, opresión en el pecho",Asma,Socota
24735653,Carmen Eduardo Pérez Gutiérrez,2011-06-04,F,SAN JUAN DE CHORRILLOS,"tos seca, pérdida de olfato, fiebre",COVID-19,Socota
22505623,Ana David López Pérez,2022-11-25,M,CASER╓O BATANCILLO,"dolor de cabeza, náuseas, sensibilidad a la luz",Migraña,Socota
91682099,Yolanda Gloria Rojas Mendoza,1938-09-20,F,VILUCO,,,Socota
79701839,Patricia Claudia Flores Silva,1935-06-28,F,EL SALLOC,"sensibilidad a la luz, náuseas",Migraña,Socota
53212017,Miguel Carolina Paredes Ramírez,1934-07-10,M,CASERIO FILADELFIA,"pérdida de olfato, fiebre, dificultad para respirar",COVID-19,Socota
19235004,Verónica Alberto Paredes Gutiérrez,2022-05-07,F,CASERIO CHURAS,"congestión nasal, fiebre",Asma,Socota
30735585,Carlos González Vargas,2000-05-26,M,SAN JOSE DE LIRIO,,,Socota
48180936,Patricia Héctor Gutiérrez Castillo,2007-07-22,M,EL CUMBE,dolor de cabeza,Gripe,Socota
75153286,Yolanda Diego Castillo Pérez,2020-08-26,F,CASERIO VILUCO,"náuseas, acidez estomacal, dolor abdominal",Gastritis,Socota
38745038,Patricia Raúl Gutiérrez Paredes,2013-08-17,M,,"micción frecuente, cansancio, sed excesiva",Diabetes,Socota
18003830,Rosa Roberto Torres Pérez,1985-02-10,M,OTRO. CUCHEA NRO. PUERTA SN PISO.01,"dolor de garganta, congestión nasal",Gripe,Socota
10236733,José Pablo Rojas Delgado,1957-03-21,M,CALLAYUC,"náuseas, dolor de cabeza",Migraña,Socota
98495118,Ana Laura Cruz Torres,1968-11-01,M,CARR. FERNANDO BELAUNDE TERRY NRO.SN BLOQUE. PISO.01 INTERIOR.  MZA.  LOTE.,"pérdida de olfato, dificultad para respirar, fiebre",COVID-19,Socota
28692216,Lucía Diego Vargas Silva,2020-08-27,M,CASERIO CHONTAS BAJAS,"picazón, ojos llorosos",Alergia,Socota
74042340,Lucía Laura Delgado Castillo,1992-05-14,F,OTRO PANPA GRANDE NRO.SN BLOQUE. PISO.01 INTERIOR.  MZA.  LOTE.,"dolor de cabeza, sensibilidad a la luz, náuseas",Migraña,Socota
42474575,Yolanda Alberto Martínez Paredes,2010-06-16,F,SAN JUAN BAUTISTIA,"dolor de cabeza, visión borrosa",Hipertensión,Socota
55456564,Lucía Raúl Rodríguez Martínez,1984-01-14,M,SAN JOSE DE LIRIO,dolor de cabeza,,Socota
64098636,Juan Isabel García Gutiérrez,1972-07-10,F,SAN JOSE DE LIRIO,"pérdida de olfato, tos seca, dificultad para respirar",COVID-19,Socota
91102667,Jorge Gloria López Rojas,1969-10-03,M,EL CUMBE,"sed excesiva, cansancio, micción frecuente",Diabetes,Socota
69963758,José Mónica Rojas Pérez,2004-07-30,F,CALLAYUC,"dificultad para respirar, sibilancias",Asma,Socota
80576568,Sandra Alberto Delgado Vargas,1997-01-01,M,OTRO. SAN ISIDRO NRO. PUERTA SN PISO.01,"dolor abdominal, náuseas, acidez estomacal",Gastritis,Socota
82952682,Verónica Pablo Cruz Silva,1972-06-24,F,LA LIBERTAD,"dolor de cabeza, náuseas",COVID-19,Socota
13361506,Patricia Sara García Torres,1946-08-01,F,CASERIO BATANCILLO,"micción frecuente, cansancio",Diabetes,Socota
11321051,María Marco Pérez Sánchez,2020-10-06,F,CASERIO EL PORVENIR,"congestión nasal, fiebre",Hipertensión,Socota
68344258,Sandra Gloria Pérez Torres,1978-05-09,F,CASERIO BATANCILLO,,,Socota
90887510,Ana Olga Mendoza Vargas,1992-10-25,M,OTRO. YUBE NRO. PUERTA SN PISO.01,,Asma,Socota
88460654,José Isabel Castillo Ramírez,1939-05-15,M,PUQUIO,"cansancio, micción frecuente",Diabetes,Socota
79606662,Patricia Mónica Ramírez Mendoza,1949-09-04,M,EL CUMBE,"dolor de cabeza, náuseas, sensibilidad a la luz",Migraña,Socota
83505434,María Claudia García Pérez,1997-06-12,M,OTRO CAMINO A SURA SN   PISO 01,dolor de cabeza,Migraña,Socota
59165168,Marta Diego Rojas Castillo,2014-08-26,F,CASERIO SAN JUAN DE CHORRILLOS,"sed excesiva, micción frecuente",Hipertensión,Socota
63079617,Rosa Pablo Pérez Torres,1941-11-15,F,CRR. A SAN JUAN DE CHORRILLOS SN   PISO 01,"náuseas, sensibilidad a la luz",Gastritis,Socota
84019124,Jorge Carolina Mendoza Gutiérrez,1969-10-29,F,CALLAYUC,"acidez estomacal, dolor abdominal",Gastritis,Socota
52479998,Ángel Claudia Vargas Cruz,1964-10-27,M,BATANCILLO,"mareos, visión borrosa",Hipertensión,Socota
21453634,Rosa Marco Mendoza Gutiérrez,1988-03-20,F,CASERIO PUQUIO,"dificultad para respirar, fiebre, tos seca",COVID-19,Socota
93933982,Pedro Diego Martínez Torres,2024-01-11,M,C.P. EL PUQUIO,"congestión nasal, dolor de garganta",Gripe,Socota
70425014,Lucía Diego Martínez Cruz,1986-05-10,F,CUCHEA,"mareos, visión borrosa",Hipertensión,Socota
88427577,Fernando Mónica Vargas Gutiérrez,1972-12-08,F,CHURAZ,"tos seca, dificultad para respirar, pérdida de olfato",COVID-19,Socota
52249347,Sandra Alberto Torres García,2004-01-22,M,SAN JUAN BAUTISTA,"micción frecuente, sed excesiva, cansancio",Diabetes,Socota
67582669,José Héctor Sánchez Vargas,1964-11-12,M,,dolor de cabeza,Diabetes,Socota
98439746,Juan Marco Cruz Rojas,2006-08-21,M,SAN ANTONIO DE VILUCO,,,Socota
54547494,Miguel Olga Cruz Martínez,1985-12-26,F,CHONTAS ALTAS,tos,,Socota
44585922,Carlos Olga González García,1974-10-03,M,CALLAYUC,"dolor de cabeza, visión borrosa, mareos",Hipertensión,Socota
58827143,Fernando Alberto Castillo Ramírez,1937-05-01,F,YAPANA,,Asma,Socota
61121665,Fernando Marco Sánchez Cruz,1973-03-27,M,VILUCO,sensibilidad a la luz,Gripe,Socota
11600387,Carlos Diego Herrera Paredes,1971-03-23,F,CALLAYUC,"tos seca, pérdida de olfato, dificultad para respirar",COVID-19,Socota
11783188,Sandra Natalia Mendoza Torres,1988-12-28,M,CASERIO VILUCO,,Diabetes,Socota
79727775,Ana Sara Torres Silva,2021-05-12,M,CASERIO SAN ISIDRO,"dificultad para respirar, sibilancias",Asma,Socota
12351666,José David Vargas Herrera,1985-12-17,M,CASERIO SAN JUAN DE CHORRILLOS,"fiebre, congestión nasal, tos",Gripe,Socota
63434341,Carlos Gloria Flores López,2024-01-07,F,CASERIO SAN JUAN DE CHORRILLOS,"dolor de garganta, tos, congestión nasal",Gripe,Socota
69404063,Marta Marco Torres Herrera,1968-12-10,F,CALLAYUC,"sensibilidad a la luz, náuseas",Migraña,Socota
31444442,Fernando Natalia Ramírez García,1948-01-01,M,,"fiebre, dificultad para respirar",COVID-19,Socota
69938821,Ángel Roberto Cruz Sánchez,2010-05-26,M,CASERIO SAN JUAN DE CHORRILLOS,dolor de cabeza,Hipertensión,Socota
26664188,Carmen Eduardo Rojas Delgado,1994-04-18,F,OTRO. SECTOR LAS NARANJAS NRO. PUERTA SN PISO.01,"dolor de garganta, fiebre, congestión nasal",Gripe,Socota
96846052,Verónica Andrés Silva Cruz,1996-01-24,F,OTRO. SAN JOSE NRO. PUERTA SN PISO.01,"náuseas, dolor de cabeza",Alergia,Socota
45272901,Rosa Raúl Ramírez Cruz,2010-11-14,F,FILA ALTA,acidez estomacal,Gripe,Socota
68108558,Rosa Andrés Cruz Torres,2014-07-22,F,CUCHEA,,,Socota
32230794,José Roberto García Castillo,1997-07-28,F,OTRO CAMINO A CUMBE SN   PISO 01,"micción frecuente, cansancio, sed excesiva",Diabetes,Socota
79252399,Ana Torres Paredes,1994-09-05,M,OTRO. SANTA RITA NRO. PUERTA SN PISO.01,"estornudos, picazón",Alergia,Socota
20421934,María Marco Silva Cruz,2008-03-01,M,SAN ISIDRO,"fiebre, pérdida de olfato",COVID-19,Socota
12497974,Yolanda Alberto Mendoza Ramírez,1991-02-22,F,FILA ALTA,"sensibilidad a la luz, dolor de cabeza",Migraña,Socota
97121790,Pedro Diego Flores Delgado,1997-11-26,F,CASERIO EL PORVENIR,"mareos, visión borrosa, dolor de cabeza",Hipertensión,Socota
50764540,Miguel Mónica Delgado Paredes,1993-05-03,F,JR COMERCIO SN,"sed excesiva, cansancio, micción frecuente",Diabetes,Socota
69885216,Lucía Pérez Sánchez,2006-05-23,F,CUCHEA,"picazón, estornudos",Alergia,Socota
78371607,Verónica Mónica Gutiérrez Castillo,2003-09-04,F,SAN ISIDRO,"sensibilidad a la luz, dolor de cabeza",Asma,Socota
72362969,Carmen Natalia Paredes Martínez,1975-02-24,M,CALLAYUC,dificultad para respirar,Gripe,Socota
44380680,Jesús David Paredes Sánchez,2017-10-27,F,OTRO. BATANCILLO NRO. PUERTA SN PISO.02,"náuseas, dolor abdominal",Gastritis,Socota
24735845,Ana Eduardo Pérez Paredes,2012-02-04,M,SANTA RITA,náuseas,Alergia,Socota
21945448,Carmen Natalia Cruz Delgado,2013-02-08,M,EL CUMBE,"sed excesiva, cansancio",Diabetes,Socota
73127410,María Alberto García Rodríguez,2001-10-10,F,C.P.EL CUMBE,,,Socota
21926791,María Gloria Paredes Pérez,2018-09-29,M,OTRO. YAPANA NRO. PUERTA SN PISO.02,"sibilancias, dificultad para respirar",Asma,Socota
23045266,Lucía Gloria Rojas Flores,1994-06-25,F,CHONTAS,"cansancio, sed excesiva",Diabetes,Socota
24870351,Verónica García López,2011-11-01,M,CASERIO YANGUA,"dolor de cabeza, visión borrosa, mareos",Hipertensión,Socota
23004067,Carmen Claudia Delgado Pérez,2019-07-04,M,OTRO SAN ISIDRO NRO.SN BLOQUE. PISO.1 INTERIOR.  MZA.  LOTE. KM.,,,Socota
68416559,Marta Alberto Flores Paredes,1981-09-16,M,OTRO. SAN JOSE NRO. PUERTA SN PISO.01,"fiebre, tos",Gripe,Socota
35277374,Rosa Diego Martínez Paredes,1986-04-15,F,OTRO SANTA RITA NRO.SN BLOQUE. PISO.01 INTERIOR.  MZA.  LOTE.,"ojos llorosos, picazón, estornudos",Alergia,Socota
53670544,José Pablo González Pérez,1980-04-02,M,CALLAYUC,"ojos llorosos, estornudos",Alergia,Socota
94152538,Ángel Héctor Vargas Silva,2022-02-03,M,YAPANA,,,Socota
77740663,Rosa Laura Delgado Flores,1973-03-07,M,CHONTAS BAJAS,"micción frecuente, sed excesiva, cansancio",Diabetes,Socota
92077287,Patricia Pablo González García,2015-05-27,F,SAN JUAN DE CHORRILLOS,"mareos, visión borrosa, dolor de cabeza",Hipertensión,Socota
42338931,Verónica Alberto Sánchez Herrera,2003-01-06,F,SAN JUAN BAUTISTA,"opresión en el pecho, sibilancias, dificultad para respirar",Asma,Socota
87839661,Jorge Sara Martínez Ramírez,2019-05-01,M,PJ. SAN JUAN DIOS NRO. PUERTA SN PISO.01,"sensibilidad a la luz, dolor de cabeza, náuseas",Migraña,Socota
93093021,Marta Mónica Vargas Castillo,1985-12-26,F,CHONTAS ALTAS,tos,,Socota
30031361,Lucía Isabel Martínez Mendoza,1960-12-22,F,EL CUMBE,"dolor de cabeza, náuseas",Migraña,Socota
73518167,María Natalia González García,1950-03-22,M,OTRO CAMINO LLANGUA SN   PISO 01,"dolor abdominal, náuseas",Gastritis,Socota
46269674,Miguel Laura Silva Rodríguez,1978-05-04,F,BATANCILLO,"tos seca, fiebre, pérdida de olfato",COVID-19,Socota
59637938,Pedro Natalia Torres Ramírez,1998-09-20,F,,"dificultad para respirar, fiebre",Migraña,Socota
58157350,Carlos Raúl Torres Silva,2005-05-23,M,EL CUMBE,opresión en el pecho,Gastritis,Socota
52814368,Marta Gloria Rodríguez Flores,1994-01-28,F,CALLE. CALLAYUC NRO. PUERTA SN PISO.01,"acidez estomacal, dolor abdominal, náuseas",Gastritis,Socota
52744207,Sandra Gloria Flores Ramírez,2022-02-06,M,CAJAMARCA - CUTERVO,"sed excesiva, micción frecuente",Diabetes,Socota
43980203,José Natalia Rodríguez Vargas,1979-12-28,F,CALLE. COMERCIO NRO. PUERTA SN PISO.01,,,Socota
30845821,Pedro Natalia Pérez García,1992-04-20,M,SAN ISIDRO,"dolor de cabeza, sensibilidad a la luz, náuseas",Migraña,Socota
41886928,José Laura Rojas Sánchez,2005-12-01,F,CUCHEA,"fiebre, dolor de garganta",Gripe,Socota
64776128,Pedro Andrés Gutiérrez Martínez,1988-05-09,F,VILUCO,tos seca,Asma,Socota
96397132,Verónica Olga Rodríguez Flores,2018-06-26,M,OTRO SAN ISIDRO NRO.SN BLOQUE. PISO.01 INTERIOR.  MZA.  LOTE.,"dolor de garganta, congestión nasal",Gripe,Socota
65757474,Jorge Isabel García Mendoza,1961-11-21,F,CASERIO GRAMALOTILLO,"dificultad para respirar, fiebre",COVID-19,Socota
61000077,Ana Luisa Herrera García,1983-01-28,M,CASERIO CHONTAS BAJAS,,,Socota
51364156,Patricia Héctor López Vargas,2020-03-05,F,CHURAZ,,,Socota
85946458,Lucía Diego Delgado Herrera,1998-04-15,F,CASERIO SAN ANTONIO DE VILUCO,"sibilancias, dificultad para respirar",Asma,Socota
16437693,Ángel David Rodríguez Cruz,2002-08-16,M,,"ojos llorosos, picazón",Gastritis,Socota
12137449,Pedro Diego Torres Cruz,1997-12-11,M,SAN ISIDRO,opresión en el pecho,Asma,Socota
27040499,Miguel Diego Herrera Paredes,1969-08-15,F,CALLAYUC,dolor de cabeza,Gastritis,Socota
85533850,Jesús Isabel Paredes Mendoza,1989-06-04,M,,"ojos llorosos, picazón",Asma,Socota
86133473,María Natalia Delgado Paredes,1990-05-13,F,CHONTAS BAJAS,dolor de garganta,Gripe,Socota
60961762,Lucía Marco Vargas López,2006-03-30,F,C.P.EL CUMBE,sibilancias,Diabetes,Socota
18280636,Lucía Andrés Delgado Gutiérrez,2020-05-06,F,CHONTAS,"micción frecuente, sed excesiva",Diabetes,Socota
94824912,Patricia Isabel Gutiérrez Flores,2001-10-11,M,EL CUMBE,,Asma,Socota
39754258,Ana Eduardo González Rodríguez,2016-02-05,M,OTRO CHORRILLOS NRO.SN BLOQUE. PISO.02 INTERIOR.  MZA.  LOTE. KM.,"ojos llorosos, picazón, estornudos",Alergia,Socota
20441808,José Raúl Torres Silva,2020-01-23,F,CALLE COMERCIO S/N,"dolor de cabeza, visión borrosa, mareos",Hipertensión,Socota
49252421,Ana Olga García Vargas,1983-01-20,M,SAN JOSE,"sensibilidad a la luz, dolor de cabeza",Migraña,Socota
35819921,Sandra Héctor Paredes Torres,1965-12-26,F,CALLAYUC,"dolor abdominal, náuseas, acidez estomacal",Gastritis,Socota
41254282,Marta Laura Cruz Herrera,2002-10-03,F,CP.EL CUMBE,fiebre,,Socota
63566164,Pedro Olga Cruz Herrera,1981-04-20,M,EL CUMBE,"tos, fiebre, dolor de garganta",Gripe,Socota
43918722,Jesús Natalia Rodríguez Herrera,2018-11-08,F,OTRO. SAN JOSE DE LIRIO NRO. PUERTA SN PISO.01,"ojos llorosos, picazón, estornudos",Alergia,Socota
25545510,Sandra Pablo Rodríguez Delgado,1996-07-13,M,EL CUMBE,"sibilancias, opresión en el pecho",Asma,Socota
44494071,Yolanda Eduardo Delgado López,1984-05-12,M,CASERIO EL CUMBE,"fiebre, tos",Gripe,Socota
75360289,Yolanda Natalia Cruz Gutiérrez,2011-06-28,M,CASERIO CUCHEA,"náuseas, sensibilidad a la luz",Migraña,Socota
50421134,Marta Laura Torres Vargas,2017-02-04,M,OTRO. SAN JOSE NRO. PUERTA SN PISO.01,,Gripe,Socota
15556778,Luis Mónica González Torres,1963-06-11,M,CASERIO SAN ISIDRO,"estornudos, picazón, ojos llorosos",Alergia,Socota
64161297,Sandra David Torres Herrera,1977-01-18,F,LA PALMA,"picazón, ojos llorosos, estornudos",Alergia,Socota
33672880,Verónica Pablo Cruz Torres,1960-04-25,M,MERENDANA,"opresión en el pecho, dificultad para respirar",Asma,Socota
51491799,Yolanda Paredes Rojas,2014-09-30,M,SAN JOSE DE LIRIO,"picazón, estornudos, ojos llorosos",Alergia,Socota
40879135,Patricia Laura Mendoza Delgado,1963-11-01,F,CASERIO YAPANA,"visión borrosa, dolor de cabeza",Hipertensión,Socota
98980626,Luis Raúl González Castillo,1996-05-27,M,OTRO. CAMINO QUE CONDUCE A BATANCILLO NRO. PUERTA SN PISO.01,"sibilancias, opresión en el pecho",Asma,Socota
69119114,Patricia Andrés Rojas Silva,1997-11-29,M,OTRO SAN JUAN BAUTISTA NRO.SN BLOQUE. PISO.02 INTERIOR.  MZA.  LOTE. KM.,"mareos, dolor de cabeza, visión borrosa",Hipertensión,Socota
55871962,Luis Silva Rodríguez,2005-01-27,F,calle comercio s/n,"sibilancias, opresión en el pecho",Asma,Socota
98378952,María Diego Rodríguez Rojas,2007-11-25,M,HUABAL,"estornudos, picazón",Asma,Socota
66486343,Carlos Rojas García,1985-04-09,F,CASERIO TOCHEPAMPA,,,Socota
52062603,Pedro Andrés Sánchez Ramírez,1985-09-30,F,CASERIO SAN JUAN BAUTISTA,"dolor abdominal, acidez estomacal",Gastritis,Socota
45125089,Luis Alberto Torres López,1975-03-27,F,SANTA FE,"dolor de garganta, tos, fiebre",Gripe,Socota
20371946,María Claudia Vargas Pérez,2010-02-21,F,PUQUIO,"dolor de cabeza, náuseas, sensibilidad a la luz",Migraña,Socota
44148264,Ana Carolina Rojas Sánchez,1999-08-12,M,EL CUMBE,"fiebre, tos, dolor de garganta",Gripe,Socota
92236275,María Diego Ramírez Rojas,2011-09-07,F,CASERIO SAN ISIDRO,"dificultad para respirar, sibilancias, opresión en el pecho",Asma,Socota
12460192,José Andrés Paredes Martínez,2001-11-12,M,CASERIO SAN JOSE,"dificultad para respirar, sibilancias, opresión en el pecho",Asma,Socota
12658840,Ana Laura Castillo González,1979-10-21,M,CASERIO EL CUMBE,ojos llorosos,Migraña,Socota
47624410,Carmen Laura Pérez Flores,1993-05-15,M,OTRO. CUCHEA NRO. PUERTA SN PISO.01,"dolor de cabeza, náuseas, sensibilidad a la luz",Migraña,Socota
87114720,Jorge Raúl González Martínez,1993-09-05,F,CUCHEA,"sed excesiva, cansancio, micción frecuente",Diabetes,Socota
13523184,Jesús Pablo Vargas Flores,1957-06-08,F,CASERIO SAN JOSE,"picazón, estornudos",Alergia,Socota
31072594,Pedro Luisa Pérez Flores,1961-12-12,M,OTRO. FRENTE AL COLISEO COMUNAL NRO. PUERTA SN PISO.02,opresión en el pecho,Gastritis,Socota
52836005,José Ramírez Cruz,2008-06-02,M,CASERIO CUCHEA,"dolor abdominal, náuseas, acidez estomacal",Gastritis,Socota
